縣市,行政區,地址,投注站名稱,Google 地圖連結
台北市,大安區,台北市大安區安居街2號1樓,柏成運動彩券行,地圖
台北市,信義區,台北市信義區松山路529號1樓,盈金多行,地圖
台北市,大安區,台北市大安區通化街24巷2之3號1樓,大神爭霸運動投注站,地圖
台北市,信義區,台北市信義區吳興街65號1樓,好樣的運動彩券行,地圖
台北市,文山區,台北市文山區忠順街一段26巷11弄2號1樓,宏寬運動彩券行,地圖
台北市,北投區,台北市北投區自強街78號1樓,鈞虹運彩行,地圖
台北市,士林區,台北市士林區中正路270、272號1樓,八方運動彩券行,地圖
台北市,內湖區,台北市內湖區康寧路三段189巷9號1樓,贏彩彩券行,地圖
台北市,士林區,台北市士林區社中街86號1樓,鑫煥運動彩券行,地圖
台北市,北投區,台北市北投區尊賢街248號1樓,一路贏運動彩券行,地圖
台北市,北投區,台北市北投區光明路200號之5(1樓),運動世界運動彩券行,地圖
台北市,北投區,台北市北投區中央南路一段137號1樓,大黑馬運動彩券行,地圖
台北市,內湖區,台北市內湖區內湖路一段377號1樓,大聯盟運動彩券行,地圖
台北市,內湖區,台北市內湖區內湖路二段11號1樓,金成功彩券行,地圖
台北市,士林區,台北市士林區天母西路57號1樓,滿貫仲運動彩券行,地圖
台北市,北投區,台北市北投區光明路132之7號1樓,發發發投注站,地圖
台北市,南港區,台北市南港區忠孝東路七段611號1樓,財神運動彩券行,地圖
台北市,南港區,台北市南港區同德路70號1樓,金五吉運動彩券行,地圖
台北市,內湖區,台北市內湖區東湖路33巷9號1樓,財星運動彩券行,地圖
台北市,內湖區,台北市內湖區內湖路一段737巷27號1樓,鑫騎白馬運動彩券行,地圖
台北市,北投區,台北市北投區實踐街33號1樓,球進來運動彩券行,地圖
台北市,內湖區,台北市內湖區江南街67號1樓,興業運動彩券行,地圖
台北市,士林區,台北市士林區中正路633號1樓,天福運彩行,地圖
台北市,內湖區,台北市內湖區康寧路一段1號1樓,全連發運動彩券行,地圖
台北市,南港區,台北市南港區昆陽街144號1樓,新移民運動彩券行,地圖
台北市,南港區,台北市南港區南港路一段45號1樓,金球運動彩券行,地圖
台北市,內湖區,台北市內湖區成功路四段61巷12號1樓,錢聯盟商行,地圖
台北市,北投區,台北市北投區明德路22號1樓,興旺煥運動彩券行,地圖
台北市,北投區,台北市北投區光明路32號1樓,鷹眼運動彩券行,地圖
台北市,內湖區,台北市內湖區成功路四段30巷7號1樓,必勝運動彩券,地圖
台北市,南港區,台北市南港區南港路三段183號1樓,聖力運動彩券行,地圖
台北市,北投區,台北市北投區中和街328號1樓,利馬鑽運動彩券行,地圖
台北市,士林區,台北市士林區通河街52號1樓,幸運女神運動彩券行,地圖
台北市,北投區,台北市北投區石牌路二段75巷4號1樓,鑫億仲運動彩券行,地圖
台北市,士林區,台北市士林區天母北路5號1樓,萬湖彩券行,地圖
台北市,士林區,台北市士林區福華路124號1樓,詹傳幃投注站,地圖
台北市,內湖區,台北市內湖區民權東路六段296巷46-2號1樓,左右包鈔運彩商行,地圖
台北市,士林區,台北市士林區承德路四段40巷30號1樓,金豐利投注站,地圖
台北市,士林區,台北市士林區延平北路六段159號1樓,聖德運動彩券行,地圖
台北市,北投區,台北市北投區中和街209號1樓,穩發運動彩券行,地圖
台北市,內湖區,台北市內湖區環山路一段74號1樓,來就發運動彩券行,地圖
台北市,士林區,台北市士林區社正路47號1樓,豪豪贏運彩行,地圖
台北市,士林區,台北市士林區天母北路22號1樓,昶鋐運彩商行,地圖
台北市,內湖區,台北市內湖區內湖路一段591巷11弄2號1樓,禾曜運動彩券行,地圖
台北市,士林區,台北市士林區美崙街42號1樓,德瑋運動彩券行,地圖
台北市,士林區,台北市士林區福港街238號1樓,國王運動彩券行,地圖
台北市,內湖區,台北市內湖區內湖路一段307號1樓,美工運動彩券行,地圖
台北市,北投區,台北市北投區知行路330號1樓,運動探大吉彩券行,地圖
台北市,北投區,台北市北投區尊賢街314號1樓,熊力嗨運動彩券行,地圖
台北市,士林區,台北市士林區天母東路8巷71號1樓,金多利彩券行,地圖
台北市,內湖區,台北市內湖區民權東路6段121號1樓,名人運動彩券行,地圖
台北市,內湖區,台北市內湖區安康路446號1樓,永元運動彩券投注站,地圖
台北市,士林區,台北市士林區德行東路188號1樓,水起秋運彩行,地圖
台北市,北投區,台北市北投區尊賢街231號1樓,盈滿滿運動彩券行,地圖
台北市,內湖區,台北市內湖區江南街65巷5號1樓,英榮萱彩券行,地圖
台北市,士林區,台北市士林區士東路91巷33號1樓,富寶地運動彩券行,地圖
台北市,士林區,台北市士林區德行西路87號1樓,禾富運動彩券行,地圖
台北市,北投區,台北市北投區實踐街19號1樓,紅兵運彩行,地圖
台北市,士林區,台北市士林區文林路143號1樓,飛淶發運動彩券行,地圖
台北市,北投區,台北市北投區三合街二段449號1樓,奇岩運彩行,地圖
台北市,南港區,台北市南港區興華路68號1樓,十三億運動彩券行,地圖
台北市,士林區,台北市士林區延平北路五段154號1樓,萬興彩券行,地圖
台北市,士林區,台北市士林區文林路499號1樓,武財神運彩行,地圖
台北市,內湖區,台北市內湖區東湖路43巷18之2號1樓,運之財運動彩券行,地圖
台北市,南港區,台北市南港區福德街320之2號1樓,天準運動彩券行,地圖
台北市,士林區,台北市士林區延平北路五段196號1樓,連八運動彩券行,地圖
台北市,士林區,台北市士林區福港街17號1樓,贏萬倍運動彩券行,地圖
台北市,內湖區,台北市內湖區東湖路113巷49弄11號1樓,機會好運動彩券行,地圖
台北市,士林區,台北市士林區和豐街32號1樓,銀河系運動彩券行,地圖
台北市,北投區,台北市北投區中和街341號1樓,第一號運動彩券行,地圖
台北市,北投區,台北市北投區中央北路一段145號1樓,億路贏運動彩券行,地圖
台北市,內湖區,台北市內湖區康寧路一段157之1號1樓,鑫發達彩券行,地圖
台北市,北投區,台北市北投區致遠二路131號1樓,贏贏贏運動彩券投注站,地圖
台北市,內湖區,台北市內湖區港墘路45號1樓,大旺發彩券行,地圖
台北市,內湖區,台北市內湖區內湖路二段98號1樓,行運彩券行,地圖
台北市,士林區,台北市士林區中正路403號1樓,神財運動彩券行,地圖
台北市,北投區,台北市北投區光明路132之9號1樓,神多運動彩券行,地圖
台北市,士林區,台北市士林區文昌路104號1樓,全多中運彩行,地圖
台北市,內湖區,台北市內湖區民權東路六段66號1樓,永大彩券行,地圖
台北市,內湖區,台北市內湖區江南街17號1樓,旺發運動彩券行,地圖
台北市,內湖區,台北市內湖區金龍路61號1樓,全聯盟運動彩券行,地圖
台北市,士林區,台北市士林區天母東路22巷23之1號1樓,五九八運動彩券行,地圖
台北市,北投區,台北市北投區東華街二段100號1樓,鑫滿貫運動彩券行,地圖
台北市,內湖區,台北市內湖區內湖路一段737巷60號1樓,關關過投注站,地圖
台北市,士林區,台北市士林區德行東路156號1樓,運來發運動彩券行,地圖
台北市,士林區,台北市士林區德行東路246號1樓,萬盛運動彩券行,地圖
台北市,北投區,台北市北投區石牌路二段62號1樓,全中運動彩券行,地圖
台北市,士林區,台北市士林區通河街102號1樓,達成運彩行,地圖
台北市,士林區,台北市士林區文林路173號1樓,每買必仲運動彩券行,地圖
台北市,士林區,台北市士林區德行西路76號1樓,雅庭投注站,地圖
台北市,內湖區,台北市內湖區內湖路一段437巷12號1樓,阡億球投注站,地圖
台北市,士林區,台北市士林區通河街141巷12號1樓,通河運動彩券行,地圖
台北市,北投區,台北市北投區中央北路二段395號1樓,熊勵嗨運動彩券行,地圖
台北市,內湖區,台北市內湖區內湖路二段420號1樓,靚鑫旺彩券行,地圖
台北市,士林區,台北市士林區忠義街127號1樓,犇來發投注站,地圖
台北市,南港區,台北市南港區中坡北路84號1樓,億取來運彩行,地圖
台北市,南港區,台北市南港區同德路41號1樓,連勝運動彩券行,地圖
台北市,南港區,台北市南港區同德路68號1樓,活力勝運動彩券行,地圖
台北市,北投區,台北市北投區明德路152號1樓,鑫贏就贏運動彩券行,地圖
台北市,士林區,台北市士林區文林路147號1樓,飛徠發運動彩券行,地圖
台北市,北投區,台北市北投區東華街一段540號1樓,穩仲運動彩券行,地圖
台北市,士林區,台北市士林區承德路四段309號1樓,滿客運彩行,地圖
台北市,士林區,台北市士林區大南路245號1樓,大南發貳肆伍運彩行,地圖
台北市,內湖區,台北市內湖區康樂街20巷1號1樓,天天過彩券行,地圖
台北市,南港區,台北市南港區研究院路二段3-7號1樓,汪旺彩券行,地圖
台北市,內湖區,台北市內湖區康樂街136巷30弄1號1樓,彩富運動彩券行,地圖
台北市,內湖區,台北市內湖區新明路387號1樓,新明運動彩券行,地圖
台北市,士林區,台北市士林區延平北路6段126號1樓,興運發運動彩券行,地圖
新北市,汐止區,新北市汐止區忠孝東路400號1樓,福氣運動彩券,地圖
新北市,深坑區,新北市深坑區北深路三段187號1樓,深藏不露運動彩券行,地圖
新北市,瑞芳區,新北市瑞芳區明燈路三段39號1樓,王牌彩券行,地圖
新北市,新店區,新北市新店區建國路96號1樓,來富貴彩券行,地圖
新北市,淡水區,新北市淡水區北新路129號1樓,奕贏商行,地圖
新北市,新店區,新北市新店區北新路二段162號1樓,鑫鑫想發運動彩券行,地圖
新北市,新店區,新北市新店區北新路一段13號1樓,財神贏家彩券行,地圖
新北市,汐止區,新北市汐止區明峰街18號1樓,承天運動彩券行,地圖
新北市,新店區,新北市新店區中正路395號1樓,動徠發運動彩券行,地圖
新北市,汐止區,新北市汐止區樟樹一路101號1樓,天聚運動彩券,地圖
新北市,新店區,新北市新店區安成街20號1樓,大家贏運彩行,地圖
新北市,新店區,新北市新店區北新路一段32號1樓,紅棍運動彩券行,地圖
新北市,新店區,新北市新店區建國路165號1樓,歐吉桑運彩行,地圖
新北市,新店區,新北市新店區安成街39號1樓,金優運動彩券行,地圖
新北市,汐止區,新北市汐止區連興街138號1樓,龍過運動彩券行,地圖
新北市,新店區,新北市新店區中正路297號1樓,樂贏贏運彩行,地圖
新北市,淡水區,新北市淡水區中山北路一段149巷6之2、3號1樓,六六六運彩行,地圖
新北市,汐止區,新北市汐止區和平街46巷22號1樓,一定贏運動彩券行,地圖
新北市,瑞芳區,新北市瑞芳區明燈路三段60號1樓,舞濱彩券行,地圖
新北市,淡水區,新北市淡水區中山路88號1樓、中山路90巷2號1樓,浩瀚運動彩券行,地圖
新北市,汐止區,新北市汐止區福德一路119號1樓,賀彩運運動彩券行,地圖
新北市,淡水區,新北市淡水區民族路39號1樓,楊咩咩彩券行,地圖
新北市,淡水區,新北市淡水區北新路182巷19號1樓,鑫獎彩券行,地圖
新北市,新店區,新北市新店區中正路503號1樓,錢來爺運動彩券行,地圖
新北市,淡水區,新北市淡水區沙崙路224、226號1樓,台灣棒運動彩券行,地圖
新北市,新店區,新北市新店區順安街49號1樓,福旺來運動彩券行,地圖
新北市,瑞芳區,新北市瑞芳區明燈路三段148號1樓,小白兔運動彩券行,地圖
新北市,金山區,新北市金山區中山路155號1樓,金再興運動彩券行,地圖
新北市,汐止區,新北市汐止區龍安路202巷49號1樓,泰樂投注站,地圖
新北市,汐止區,新北市汐止區福德二路52號1樓,大谷翔平彩券行,地圖
新北市,新店區,新北市新店區中正路282之1號1樓,億萬運彩行,地圖
新北市,新店區,新北市新店區民族路221號1樓,來就賺運彩行,地圖
新北市,新店區,新北市新店區北新路二段97巷12號1樓,贏到爆運彩行,地圖
新北市,汐止區,新北市汐止區中正路11號1樓,天天發企業社,地圖
新北市,新店區,新北市新店區光明街83號1樓,多采多姿運動彩券行,地圖
新北市,汐止區,新北市汐止區忠孝東路268號1樓,廣合發運動彩券行,地圖
新北市,汐止區,新北市汐止區明峰街115號1樓,你該得運彩行,地圖
新北市,深坑區,新北市深坑區北深路三段208號1樓,贏家對決運動彩券行,地圖
新北市,汐止區,新北市汐止區連興街123號1樓,連興運動彩券行,地圖
新北市,汐止區,新北市汐止區明峰街27號1樓,齊來發運動彩券行,地圖
新北市,新店區,新北市新店區安和路二段171號1樓,金興發運動彩券行,地圖
新北市,汐止區,新北市汐止區樟樹一路32號1樓,繁星運動投注站,地圖
新北市,金山區,新北市金山區中山路141號1樓,今博弈運動彩券行,地圖
新北市,新店區,新北市新店區中興路三段147號1樓,泰利彩券行,地圖
新北市,汐止區,新北市汐止區福德一路246號1樓,金興旺運動彩券行,地圖
新北市,汐止區,新北市汐止區福德一路210號1樓,多鑫運動彩券行,地圖
新北市,新店區,新北市新店區新生街5巷1號1樓,常勝黑馬運動彩券行,地圖
新北市,汐止區,新北市汐止區忠孝東路302號1樓,超級棒運動彩券,地圖
新北市,汐止區,新北市汐止區連興街6號1樓,星宇運動彩券行,地圖
新北市,汐止區,新北市汐止區忠孝東路270號1樓,福氣旺運動彩券行,地圖
新北市,汐止區,新北市汐止區忠孝東路280號1樓,祥隆運動彩券行,地圖
新北市,淡水區,新北市淡水區民族路28號1樓,每天發彩券行,地圖
新北市,汐止區,新北市汐止區建成路168號1樓,超行星運動彩券行,地圖
新北市,深坑區,新北市深坑區埔新街62號1樓,全明星投注站,地圖
新北市,新店區,新北市新店區中華路1號1樓,佰面贏彩券行,地圖
新北市,淡水區,新北市淡水區清水街40號1樓,瀛定運動彩券行,地圖
新北市,新店區,新北市新店區光明街88號1樓,恩典滿滿運彩行,地圖
新北市,汐止區,新北市汐止區福德一路180號1樓,采輝運動彩券行,地圖
新北市,汐止區,新北市汐止區福德二路165號1樓,旺財運彩行,地圖
新北市,深坑區,新北市深坑區埔新街87號1樓,太齊運動彩券行,地圖
新北市,新店區,新北市新店區民族路39號1樓,十方來財運動彩券行,地圖
新北市,新店區,新北市新店區光明街167號1樓,好好中彩券行,地圖
新北市,新店區,新北市新店區安康路二段171號1樓,彬羽運動彩券行,地圖
新北市,淡水區,新北市淡水區中山路186號1樓,緣錢運動彩券行,地圖
新北市,新店區,新北市新店區中正路516之1號1樓,真的旺玖玖運動彩券行,地圖
新北市,汐止區,新北市汐止區中興路152之2號1樓,多利運動彩券行,地圖
新北市,新店區,新北市新店區玫瑰路58巷3號1樓,金多吉運動彩券行,地圖
新北市,新店區,新北市新店區大豐路2之1號1樓,富億運動彩券行,地圖
新北市,新店區,新北市新店區中正路282之6號1樓,金鑫旺運動彩券行,地圖
新北市,淡水區,新北市淡水區新春街94號1樓,世界大運動彩券行,地圖
新北市,淡水區,新北市淡水區大忠街14號1樓,中華大運動彩券行,地圖
新北市,汐止區,新北市汐止區新興路22號1樓,新興運動彩券行,地圖
新北市,新店區,新北市新店區安康路二段226號1樓,贏就來運彩行,地圖
新北市,淡水區,新北市淡水區中山路70號、70之2號1樓,益萬運動彩券行,地圖
新北市,淡水區,新北市淡水區新春街197號1樓,人仁發商行,地圖
新北市,新店區,新北市新店區永安街76號1樓,客必勝運動彩券行,地圖
新北市,新店區,新北市新店區安民街140號1樓,金旺吉康運動彩券行,地圖
新北市,新店區,新北市新店區民族路48巷1號1樓,點球運動彩券行,地圖
新北市,瑞芳區,新北市瑞芳區明燈路三段39之2號1樓,風起運有運動彩券行,地圖
新北市,板橋區,新北市板橋區國光路179號1樓,幸運星運動彩券行,地圖
新北市,土城區,新北市土城區中正路59號1樓,村發發運動彩券行,地圖
新北市,土城區,新北市土城區裕民路136巷3號1樓,富發商行,地圖
新北市,板橋區,新北市板橋區自由路3號1樓,鈞贏運彩行,地圖
新北市,板橋區,新北市板橋區莒光路188號1樓,嘉實運彩行,地圖
新北市,土城區,新北市土城區中央路四段184號1樓,益田運動彩券行,地圖
新北市,土城區,新北市土城區裕民路196號1樓,鈺財發運動彩券行,地圖
新北市,土城區,新北市土城區延吉街264號1樓,吉鴻發運動彩券行,地圖
新北市,板橋區,新北市板橋區南門街68號、70號1樓,和億運動彩券行,地圖
新北市,板橋區,新北市板橋區莒光路1號1樓,倍倍樂運動彩券行,地圖
新北市,板橋區,新北市板橋區四維路182號1樓,宏準投注站,地圖
新北市,土城區,新北市土城區中央路二段166號1樓,祥運發運動彩券行,地圖
新北市,板橋區,新北市板橋區存德街12號1樓,穩發運動彩券,地圖
新北市,板橋區,新北市板橋區文聖街12號1樓,紘富彩券行,地圖
新北市,板橋區,新北市板橋區國慶路212號1樓,錢亦來運彩行,地圖
新北市,三峽區,新北市三峽區愛國路2號1樓,神來運轉運動彩券行,地圖
新北市,板橋區,新北市板橋區松江街120號1樓,盈曜投注站,地圖
新北市,板橋區,新北市板橋區四維路282號1樓,四維運動彩券,地圖
新北市,土城區,新北市土城區峯廷街60號1樓,赤木運動彩券行,地圖
新北市,板橋區,新北市板橋區大仁街54號1樓,玄發彩券行,地圖
新北市,土城區,新北市土城區延平街15號1樓,方得贏運動彩券行,地圖
新北市,土城區,新北市土城區中央路一段201號1樓,石運發運動彩券行,地圖
新北市,三峽區,新北市三峽區國學街12之1號1樓,旺福發運動彩券行,地圖
新北市,板橋區,新北市板橋區大仁街72號1樓,雙冠王投注站,地圖
新北市,三峽區,新北市三峽區大學路86號1樓,九十九運動彩券行,地圖
新北市,板橋區,新北市板橋區民族路275號1樓,百億旺彩券商店,地圖
新北市,板橋區,新北市板橋區府中路114號1樓,洺元運動彩券行,地圖
新北市,土城區,新北市土城區廣明街55號1樓,熊好中運動彩券投注站,地圖
新北市,板橋區,新北市板橋區文德路47號1樓,金牌發運動彩券行,地圖
新北市,土城區,新北市土城區中央路二段16號1樓,來全勝運動彩券行,地圖
新北市,土城區,新北市土城區學成路24號1樓,過千倍運動彩券行,地圖
新北市,板橋區,新北市板橋區篤行路二段128號1樓,必勝運動彩券投注行,地圖
新北市,板橋區,新北市板橋區莊敬路152號1樓,頂尖運動彩券行,地圖
新北市,三峽區,新北市三峽區中山路192號1樓,神來也運動彩券行,地圖
新北市,板橋區,新北市板橋區雙十路二段37號1樓,好運發運動彩券行,地圖
新北市,板橋區,新北市板橋區三民路二段237號1樓,錢家企業社,地圖
新北市,土城區,新北市土城區學府路一段208號1樓,曼巴世界運動彩券行,地圖
新北市,板橋區,新北市板橋區合宜路41號1樓,合曜投注站,地圖
新北市,土城區,新北市土城區學府路一段74號1樓,玉元發運動彩券行,地圖
新北市,板橋區,新北市板橋區四川路二段47巷2弄1號1樓,鑽多多運動彩券行,地圖
新北市,三峽區,新北市三峽區光明路60號1樓,三角湧運彩投注行,地圖
新北市,土城區,新北市土城區員林街8之1號1樓,雷神運動彩券投注站,地圖
新北市,土城區,新北市土城區明德路二段141號1樓,一級棒運動彩券行,地圖
新北市,三峽區,新北市三峽區光明路33號1樓,過八關運動彩券行,地圖
新北市,板橋區,新北市板橋區中山路二段378號1樓,菁華運彩行,地圖
新北市,土城區,新北市土城區學成路182號1樓,全壘打運動彩券,地圖
新北市,板橋區,新北市板橋區新海路418號1樓,溢滿運動彩券行,地圖
新北市,板橋區,新北市板橋區懷德街127巷26號1樓,鑫萬億運動彩券行,地圖
新北市,板橋區,新北市板橋區忠孝路225號1樓,嘉嘉運彩行,地圖
新北市,板橋區,新北市板橋區溪北路3號1樓,祥富一路發運動彩券行,地圖
新北市,板橋區,新北市板橋區三民路二段199號1樓,万裕彩券行,地圖
新北市,土城區,新北市土城區中正路15之1號1樓,全球運動彩券行,地圖
新北市,土城區,新北市土城區中央路二段278巷12號1樓,美香運動彩券投注站,地圖
新北市,土城區,新北市土城區中央路四段281之3號1樓,太陽城運動彩券行,地圖
新北市,土城區,新北市土城區裕民路234號1樓,贏滿袋運動彩券行,地圖
新北市,板橋區,新北市板橋區文化路一段435巷31弄3號1樓,綠光運動彩券行,地圖
新北市,三峽區,新北市三峽區中園街20之1號1樓,傳奇運動彩券行,地圖
新北市,土城區,新北市土城區明德路二段221號1樓,奇樂運動彩券投注站,地圖
新北市,土城區,新北市土城區明峯街31號1樓,喜豐行,地圖
新北市,土城區,新北市土城區明峯街30號1樓,領域運動彩券行,地圖
新北市,板橋區,新北市板橋區裕民街48號1樓,五二八運動彩券行,地圖
新北市,土城區,新北市土城區廣明街50號1樓,田享運動彩券行,地圖
新北市,三峽區,新北市三峽區長泰街55號1樓,神來旺運動彩券行,地圖
新北市,三峽區,新北市三峽區大德路485之1號1樓,關關過運動彩券,地圖
新北市,三峽區,新北市三峽區長福街6之2號1樓,好運發發發運動彩券行,地圖
新北市,板橋區,新北市板橋區館前西路154之2號1樓,高頂運動彩券,地圖
新北市,板橋區,新北市板橋區合宜路73號1樓,天天過運動彩券,地圖
新北市,板橋區,新北市板橋區篤行路三段玉平巷68弄4號1樓,大富豪運動彩券行,地圖
新北市,板橋區,新北市板橋區三民路二段205之2號1樓,鑫鑫運動彩券行,地圖
新北市,板橋區,新北市板橋區國慶路163號1樓,博盈運動彩券行,地圖
新北市,三峽區,新北市三峽區復興路36之6號1樓,巴克利運動彩券行,地圖
新北市,土城區,新北市土城區學成路97之1號1樓,吉中運動彩券行,地圖
新北市,板橋區,新北市板橋區吳鳳路19之5號1樓,尚虹運動彩券行,地圖
新北市,板橋區,新北市板橋區懷德街181巷13號1樓,大力王運動彩券行,地圖
新北市,板橋區,新北市板橋區四維路107號1樓,富豪富運彩行,地圖
新北市,板橋區,新北市板橋區中正路268號1樓,聚星運彩行,地圖
新北市,土城區,新北市土城區延和路166號1樓,喜報運動彩券行,地圖
新北市,板橋區,新北市板橋區三民路二段137號1樓,福利旺運動彩券行,地圖
新北市,板橋區,新北市板橋區中正路355號1樓,大旺運動彩券行,地圖
新北市,板橋區,新北市板橋區裕民街71號1樓,裕民運動彩券,地圖
新北市,土城區,新北市土城區延和路122號1樓,世界一運動彩券行,地圖
新北市,土城區,新北市土城區明德路一段39號1樓,必勝客運動彩券行,地圖
新北市,板橋區,新北市板橋區觀光街22號1樓,先鋒運動彩券行,地圖
新北市,板橋區,新北市板橋區國光路57號1樓,文華商行,地圖
新北市,土城區,新北市土城區中央路三段58號1樓,怡得發電腦彩券行,地圖
新北市,土城區,新北市土城區中央路一段227號1樓,吉冠軍運動彩券投注站,地圖
新北市,土城區,新北市土城區青雲路279號1樓,隆益發運動彩券行,地圖
新北市,板橋區,新北市板橋區忠孝路168號1樓,錢易來運彩行,地圖
新北市,土城區,新北市土城區中央路二段362號1樓,鉅亨運動彩券行,地圖
新北市,三峽區,新北市三峽區民權街241號1樓,金球運動彩券行,地圖
新北市,三峽區,新北市三峽區文化路107號1樓,福神翔旺運動彩券行,地圖
新北市,土城區,新北市土城區清水路239號1樓,均財發運動彩券行,地圖
新北市,土城區,新北市土城區延吉街102號1樓,幸運之星運動彩券行,地圖
新北市,板橋區,新北市板橋區中正路365號1樓,鑫旺來運動彩券行,地圖
新北市,板橋區,新北市板橋區重慶路278之2號1樓,千運來運動彩券行,地圖
新北市,板橋區,新北市板橋區長安街210之3號1樓,福利鑫彩券商行,地圖
新北市,土城區,新北市土城區員福街28號1樓,雷霆運動彩券行,地圖
新北市,板橋區,新北市板橋區文聖街140巷1號1樓,祐聖運動彩券,地圖
新北市,板橋區,新北市板橋區民族路288號1樓,阿財運動彩券行,地圖
新北市,板橋區,新北市板橋區中山路二段90巷25號1樓,神奇柑仔店運彩行,地圖
