縣市,行政區,地址,投注站名稱,Google 地圖連結
嘉義市,東區,嘉義市東區忠孝北街221號1樓,泳勝運動彩券行,地圖
嘉義市,西區,嘉義市西區民生南路562號1樓,尚鼎發運動彩券,地圖
嘉義市,西區,嘉義市西區友愛路186號1樓,一定發運動彩券行,地圖
嘉義市,西區,嘉義市西區民族路694號1樓,鴻運運動彩券行,地圖
嘉義市,東區,嘉義市東區光華路107號1樓,双嚮炮運動彩券行,地圖
嘉義市,東區,嘉義市東區興業東路110號1樓,真好野運動彩券行,地圖
嘉義市,東區,嘉義市東區民族路158號1樓,冠君運動彩券,地圖
嘉義市,西區,嘉義市西區仁愛路558號1樓,伍貳捌運動彩券行,地圖
嘉義市,西區,嘉義市西區南京路410號1樓,伍壹捌運動彩券行,地圖
嘉義市,東區,嘉義市東區林森東路607號1樓,華客多運動彩券行,地圖
嘉義市,西區,嘉義市西區文化路555號1樓,聚寶運動彩券行,地圖
嘉義市,東區,嘉義市東區新生路818號1樓,焦點運動彩券行,地圖
嘉義市,西區,嘉義市西區民生北路145號1樓,金包贏運動彩券行,地圖
嘉義市,西區,嘉義市西區友愛路160號1樓,博盈運動彩券行,地圖
嘉義市,東區,嘉義市東區林森東路361號1樓,環球運動彩券行,地圖
嘉義市,東區,嘉義市東區吳鳳南路362號1樓,金永發運動彩券行,地圖
嘉義市,西區,嘉義市西區新榮路345號1樓,新榮運彩投注站,地圖
嘉義市,東區,嘉義市東區興業東路306號1樓,明昌運動彩券行,地圖
嘉義市,西區,嘉義市西區興業西路389號1樓,來就發運動彩券行,地圖
嘉義市,西區,嘉義市西區興業西路99號1樓,全都中運動彩券行,地圖
嘉義市,東區,嘉義市東區林森東路462號1樓,球星運動彩券投注站,地圖
嘉義市,西區,嘉義市西區玉山路110號1樓,泳發運動彩券行,地圖
嘉義市,東區,嘉義市東區吳鳳北路138號1樓,一路發運動彩券行,地圖
嘉義市,西區,嘉義市西區新民路822號1樓,買就贏運動彩券,地圖
嘉義市,西區,嘉義市西區上海路229號1樓,孔雀運動彩券,地圖
嘉義市,西區,嘉義市西區林森西路266號1樓,漲停板運動彩券行,地圖
嘉義市,西區,嘉義市西區國華街76之1號1樓,大家樂運動彩券,地圖
嘉義市,西區,嘉義市西區西門街202號之1(1樓),錢攏來運動彩券行,地圖
嘉義市,西區,嘉義市西區北興街406號1樓,金旺好運動彩券行,地圖
基隆市,安樂區,基隆市安樂區麥金路186號1樓,真棒運動彩券行,地圖
基隆市,信義區,基隆市信義區深溪路168號1樓,好運發彩券行,地圖
基隆市,中正區,基隆市中正區義二路28號1樓,富貴運動彩券行,地圖
基隆市,七堵區,基隆市七堵區工建路1-19號1樓,好運到彩券行,地圖
基隆市,中正區,基隆市中正區北寧路368之1號1樓,八斗運動彩券,地圖
基隆市,七堵區,基隆市七堵區百三街62號1樓,世界盃運動彩券行,地圖
基隆市,中正區,基隆市中正區新豐街308號1樓,新豐運動彩券行,地圖
基隆市,仁愛區,基隆市仁愛區愛四路26之1號1樓,成富豪運動彩券,地圖
基隆市,仁愛區,基隆市仁愛區仁三路37號1樓,聯鎂彩券行,地圖
基隆市,中山區,基隆市中山區中和路166之4號1樓,小聯盟運動彩券行,地圖
基隆市,信義區,基隆市信義區義六路15號1樓,運寶成彩券行,地圖
基隆市,仁愛區,基隆市仁愛區仁四路54之1、2號1樓,全壘打運動彩券行,地圖
基隆市,仁愛區,基隆市仁愛區孝三路82號1樓,超級盃運動彩券行,地圖
基隆市,暖暖區,基隆市暖暖區源遠路305號1樓,宏龍彩券行,地圖
基隆市,信義區,基隆市信義區深溪路110號1樓,爆米發運動彩券行,地圖
基隆市,中正區,基隆市中正區義二路10號1樓,建宸運動彩券行,地圖
基隆市,七堵區,基隆市七堵區開元路69號1樓,一級棒運彩行,地圖
基隆市,中山區,基隆市中山區安一路15號1樓,錸錸發投注站,地圖
基隆市,安樂區,基隆市安樂區安樂路二段120號1樓,富豪運動彩券行,地圖
基隆市,暖暖區,基隆市暖暖區源遠路192號1樓,連贏運動彩券,地圖
基隆市,信義區,基隆市信義區信二路71號1樓,金讚運動彩券行,地圖
基隆市,中山區,基隆市中山區復興路162號1樓,金來贏運彩行,地圖
基隆市,仁愛區,基隆市仁愛區仁二路28號1樓,大家贏彩券行,地圖
基隆市,仁愛區,基隆市仁愛區仁三路54號1樓,快來旺運動彩券行,地圖
基隆市,安樂區,基隆市安樂區基金一路133-4號1樓,富裕運動彩券行,地圖
基隆市,仁愛區,基隆市仁愛區仁四路24號1樓,少將腳運動彩券投注站,地圖
基隆市,安樂區,基隆市安樂區基金三路139號1樓,一夜暴富運彩行,地圖
基隆市,中山區,基隆市中山區復興路252號1樓,富聯運動彩券行,地圖
基隆市,中正區,基隆市中正區北寧路352號1樓,鴻富運動彩券行,地圖
基隆市,安樂區,基隆市安樂區安樂路二段235號1樓,一定贏運動彩券行,地圖
基隆市,仁愛區,基隆市仁愛區仁四路28號1樓,金鶯運動彩券行,地圖
基隆市,七堵區,基隆市七堵區明德一路109號1樓,仟佰倍運動彩券行,地圖
基隆市,中山區,基隆市中山區復興路109號1樓,八中八運動彩券行,地圖
基隆市,仁愛區,基隆市仁愛區孝三路26號1樓,金興彩券行,地圖
基隆市,暖暖區,基隆市暖暖區暖暖街477號1樓,金來運動彩券行,地圖
基隆市,信義區,基隆市信義區深溪路160號1樓,鴻吉運動彩券行,地圖
基隆市,安樂區,基隆市安樂區基金一路393號1樓,神采運動彩券行,地圖
新竹市,東區,新竹市東區東門街85號,東門之心運動彩券,地圖
新竹市,東區,新竹市東區光復路一段166號1樓,金鼎豐運動彩券行,地圖
新竹市,東區,新竹市東區西大路89號1樓,包你發運動彩券,地圖
新竹市,香山區,新竹市香山區香北路193號1樓,財旺運動彩券行,地圖
新竹市,北區,新竹市北區湳雅街2-1號1樓,非中不可商行,地圖
新竹市,東區,新竹市東區鐵道路二段10號1樓,金富貴運彩投注站,地圖
新竹市,北區,新竹市北區中正路281號1樓,禾秦運動彩券行,地圖
新竹市,東區,新竹市東區高翠路369號1樓,財來運轉商行,地圖
新竹市,北區,新竹市北區北新街58號1樓,冠達運彩行,地圖
新竹市,東區,新竹市東區金山街131號1樓,幸運之星運彩商行,地圖
新竹市,東區,新竹市東區林森路32號1樓,金竹旺運動彩券行,地圖
新竹市,東區,新竹市東區金山街3號1樓,龍強商行,地圖
新竹市,北區,新竹市北區中山路420號1樓,財神旺運彩行,地圖
新竹市,東區,新竹市東區竹蓮街70號1樓,竹蓮發運動彩券行,地圖
新竹市,東區,新竹市東區南大路653號1樓,金順發運動彩券,地圖
新竹市,東區,新竹市東區南大路398號1樓,紅發運彩商行,地圖
新竹市,北區,新竹市北區西大路579號1樓,金福氣運彩行,地圖
新竹市,北區,新竹市北區湳雅街42號1樓,金泰豐運動彩券行,地圖
新竹市,北區,新竹市北區北門街5號1樓,照旺運動彩券行,地圖
新竹市,東區,新竹市東區東南街157號1樓,帶財運動彩券行,地圖
新竹市,北區,新竹市北區中山路428號1樓,天公伯運動彩券行,地圖
新竹市,東區,新竹市東區新源街90號1樓,大滿貫運彩行,地圖
新竹市,東區,新竹市東區光復路一段310號1樓,全民商行,地圖
新竹市,東區,新竹市東區長春街62巷1號1樓,長春利運動彩券行,地圖
新竹市,東區,新竹市東區金山街101號1樓,壹零壹商行,地圖
新竹市,北區,新竹市北區西大路724號1樓,鈔好中彩券行,地圖
新竹市,香山區,新竹市香山區內湖路88之2號1樓,飛來富運彩投注站,地圖
新竹市,香山區,新竹市香山區香北路152號1樓,雙贏運動彩券,地圖
新竹市,北區,新竹市北區西大路509號1樓,強強滾運彩行,地圖
新竹市,東區,新竹市東區埔頂路294號1樓,一定發運動彩券,地圖
新竹市,東區,新竹市東區民生路75號1樓,羿鑫投注站,地圖
新竹市,東區,新竹市東區南大路289、291號1樓,一兆運動彩券行,地圖
新竹市,東區,新竹市東區長春街12號1樓,翔龍商行,地圖
新竹市,東區,新竹市東區建功一路186號1樓,齊勝運動彩券行,地圖
新竹市,北區,新竹市北區東大路三段710號1樓,鴻鴻運動彩券行,地圖
新竹市,東區,新竹市東區林森路185號1樓,金財神運動彩券行,地圖
新竹市,北區,新竹市北區中山路86號1樓,贏達運動彩券行,地圖
新竹市,東區,新竹市東區高翠路307號1樓,幸運大聯盟彩券行,地圖
新竹市,東區,新竹市東區光復路一段659號1樓,一路發運彩商行,地圖
新竹市,東區,新竹市東區科學園路145號1樓,六鑫旺運動彩券,地圖
新竹市,香山區,新竹市香山區牛埔路421號1樓,金賀勝運動彩券行,地圖
新竹市,東區,新竹市東區民生路252號1樓,福贏運動彩券行,地圖
新竹市,香山區,新竹市香山區香北路147號1樓,滿億彩券行,地圖
新竹市,東區,新竹市東區新莊街158號1樓,壹伍捌商行,地圖
新竹市,東區,新竹市東區民權路153號1樓,巨城運動彩券,地圖
新竹市,北區,新竹市北區金竹路131號1樓,全虹運運動彩券行,地圖
新竹市,北區,新竹市北區西門街103號1樓,飛來旺運動彩券,地圖
新竹市,北區,新竹市北區光華南街40號1樓,爆發富運彩商行,地圖
新竹市,北區,新竹市北區北大路318號1樓,直過關運動彩,地圖
新竹市,北區,新竹市北區民富街97號1樓,天下第一莊運動彩券,地圖
新竹市,東區,新竹市東區振興路125號1樓,球球運動彩券,地圖
新竹市,東區,新竹市東區竹蓮街82號1樓,金鈺鑫運動彩券行,地圖
新竹市,北區,新竹市北區光華一街28號1樓,又中獎運動彩券,地圖
台東縣,臺東市,台東縣台東市正氣北路213號1樓,好運樹投注站,地圖
台東縣,臺東市,台東縣台東市博愛路85號1樓,東成商行,地圖
台東縣,臺東市,台東縣台東市中華路一段245號1樓,贏家運動彩券行,地圖
台東縣,臺東市,台東縣台東市中華路一段519號1樓,好運旺運動彩券,地圖
台東縣,臺東市,台東縣台東市正氣路158號1樓,金發財運動彩券行,地圖
台東縣,臺東市,台東縣台東市開封街411之1號1樓,金牌運動彩券行,地圖
台東縣,臺東市,台東縣台東市漢陽北路207號1樓,愛斯特運動彩券,地圖
台東縣,臺東市,台東縣台東市更生路148巷3號1樓,翻滾吧運動彩券行,地圖
台東縣,臺東市,台東縣台東市中華路一段560號1樓,得荔運彩行,地圖
台東縣,成功鎮,台東縣成功鎮大同路42號1樓,成功一星運動彩券行,地圖
台東縣,東河鄉,台東縣東河鄉都蘭92號1樓,金大咖運動彩券行,地圖
台東縣,臺東市,台東縣台東市光明路241號1樓,勒芒運動彩券行,地圖
台東縣,臺東市,台東縣台東市漢陽北路159號1樓,利曼運動彩券行,地圖
台東縣,臺東市,台東縣台東市正氣路179號1樓,薩爾特運動彩券行,地圖
台東縣,成功鎮,台東縣成功鎮中華路98、100號1樓,勝利玩家運動彩券行,地圖
台東縣,臺東市,台東縣台東市中華路二段252號1樓,鑫賓樂運動彩券行,地圖
台東縣,關山鎮,台東縣關山鎮和平路87之1號1樓,八八八運動彩券行,地圖
台東縣,鹿野鄉,台東縣鹿野鄉中華路二段30號1樓,六六六運動彩券行,地圖
金門縣,金寧鄉,金門縣金寧鄉頂堡62之1號1樓,鑫裡有您運動彩券行,地圖
金門縣,金城鎮,金門縣金城鎮浯江北堤路27號1樓,鑫發怒放運動彩券行,地圖
金門縣,金湖鎮,金門縣金湖鎮夏興5之1號1樓,鑫鑫向榮運動彩券行,地圖
金門縣,金城鎮,金門縣金城鎮民權路115號1樓,鑫鑫相印運動彩券行,地圖
金門縣,金湖鎮,金門縣金湖鎮市港路150號1樓,鑫騎白馬運動彩券行,地圖
金門縣,金沙鎮,金門縣金沙鎮五福街28號1樓,鑫想事成運動彩券行,地圖
嘉義縣,朴子市,嘉義縣朴子市文化北路34號1樓,銀鑽商行,地圖
嘉義縣,中埔鄉,嘉義縣中埔鄉中山路五段870號1樓,新億運動彩券行,地圖
嘉義縣,太保市,嘉義縣太保市中興路一段602號1樓,太保財財運動彩券行,地圖
嘉義縣,水上鄉,嘉義縣水上鄉中興路450號1樓,金牌運彩行,地圖
嘉義縣,新港鄉,嘉義縣新港鄉中山路奉天大廈3號1樓,林衛商店,地圖
嘉義縣,民雄鄉,嘉義縣民雄鄉福樂村埤角2號之79(1樓),大爆發運動彩券行,地圖
嘉義縣,民雄鄉,嘉義縣民雄鄉福樂村埤角559號1樓,日勝運動彩券行,地圖
嘉義縣,大林鎮,嘉義縣大林鎮西林里中興一路7號1樓,百勝運動彩券行,地圖
嘉義縣,新港鄉,嘉義縣新港鄉中山路56號1樓,吉冠運動彩券行,地圖
嘉義縣,中埔鄉,嘉義縣中埔鄉和睦村司公廍4之20號1樓,得冠軍運動彩券行,地圖
嘉義縣,朴子市,嘉義縣朴子市山通路136之2號1樓,黃金地王運動彩券店,地圖
嘉義縣,義竹鄉,嘉義縣義竹鄉六桂村義竹186號1樓,好朋友投注站,地圖
嘉義縣,大林鎮,嘉義縣大林鎮中興路223號1樓,來勝運動彩券行,地圖
嘉義縣,朴子市,嘉義縣朴子市開元路285號1樓,希旺商行,地圖
嘉義縣,民雄鄉,嘉義縣民雄鄉民生路2之3號1樓,玖捌玖運動彩券行,地圖
嘉義縣,朴子市,嘉義縣朴子市海通路60之3、60之4號1樓,壹陸陸運動彩券行,地圖
嘉義縣,新港鄉,嘉義縣新港鄉中山路23號1樓,大贏家運動彩券行,地圖
嘉義縣,民雄鄉,嘉義縣民雄鄉東榮村中樂路13號1樓,全勝運動彩券行,地圖
嘉義縣,布袋鎮,嘉義縣布袋鎮太平東路461號1樓,押對寶運動彩券店,地圖
澎湖縣,馬公市,澎湖縣馬公市光明路2之4號1樓,金路發運動彩券行,地圖
澎湖縣,馬公市,澎湖縣馬公市光明里光復路127號1樓,百富運動彩券行,地圖
澎湖縣,馬公市,澎湖縣馬公市光復路189號1樓,大本運動彩券,地圖
澎湖縣,馬公市,澎湖縣馬公市中正路44號1樓,中正運動彩券,地圖
澎湖縣,馬公市,澎湖縣馬公市光復路223號1樓,澎福運動彩券行,地圖
澎湖縣,馬公市,澎湖縣馬公市光明路19-1號1樓,鈔多多運動彩券,地圖
澎湖縣,馬公市,澎湖縣馬公市三多路202號1樓,好運到運動彩券,地圖
澎湖縣,馬公市,澎湖縣馬公市海埔路21號1樓,億值贏運動彩券行,地圖
澎湖縣,馬公市,澎湖縣馬公市文山路5號1樓,時來運轉運動彩券,地圖
雲林縣,斗六市,雲林縣斗六市石榴路80號1樓,幸福久久運動彩券行,地圖
雲林縣,斗六市,雲林縣斗六市民生路139號1樓,億富運動彩券行,地圖
雲林縣,斗六市,雲林縣斗六市中山路364-1號1樓,報您發運動彩券行,地圖
雲林縣,斗六市,雲林縣斗六市仁義路87號1樓,鑫聯發運動彩券行,地圖
雲林縣,北港鎮,雲林縣北港鎮文化路56-6號1樓,北港運動彩券行,地圖
雲林縣,莿桐鄉,雲林縣莿桐鄉中正路63號1樓,莿桐運彩商行,地圖
雲林縣,麥寮鄉,雲林縣麥寮鄉中山路190號1樓,旺福運動彩券行,地圖
雲林縣,斗六市,雲林縣斗六市中正路32號1樓,賺很大運動彩券行,地圖
雲林縣,虎尾鎮,雲林縣虎尾鎮林森路二段291號1樓,聚萬運動彩券行,地圖
雲林縣,麥寮鄉,雲林縣麥寮鄉麥豐村中山路162號1樓,通發運動彩券行,地圖
雲林縣,古坑鄉,雲林縣古坑鄉中山路163-1號1樓,金牌運動彩券行,地圖
雲林縣,麥寮鄉,雲林縣麥寮鄉中山路407號1樓,福旺運動彩券,地圖
雲林縣,虎尾鎮,雲林縣虎尾鎮立德路5號1樓,立德運動彩券行,地圖
雲林縣,斗六市,雲林縣斗六市北平路30之7號1樓,財富自由運動彩券行,地圖
雲林縣,西螺鎮,雲林縣西螺鎮延平路167號1樓,鴻發運動彩券行,地圖
雲林縣,北港鎮,雲林縣北港鎮文化路168號1樓,億旺運動彩券行,地圖
雲林縣,斗六市,雲林縣斗六市鎮南路212號1樓,海豐運動彩券行,地圖
雲林縣,麥寮鄉,雲林縣麥寮鄉新興路29號1樓,福星運動彩券行,地圖
雲林縣,莿桐鄉,雲林縣莿桐鄉中山路115號1樓,金好過運動彩券行,地圖
雲林縣,土庫鎮,雲林縣土庫鎮建國路166號1樓,錢會來運動彩券行,地圖
雲林縣,斗六市,雲林縣斗六市內環路890號1樓,金福氣運動彩券行,地圖
雲林縣,麥寮鄉,雲林縣麥寮鄉仁德路303號1樓,發發發運動彩券行,地圖
雲林縣,崙背鄉,雲林縣崙背鄉建國路43號1樓,崙發運動彩券行,地圖
雲林縣,斗南鎮,雲林縣斗南鎮中山路46號1樓,一直贏運動彩券行,地圖
雲林縣,麥寮鄉,雲林縣麥寮鄉中興路34號1樓,好運發運動彩券行,地圖
雲林縣,斗六市,雲林縣斗六市信義里太平路10號1樓,中很大運動彩券行,地圖
雲林縣,斗六市,雲林縣斗六市太平路145號1樓,金富豪運動彩券行,地圖
雲林縣,斗六市,雲林縣斗六市萬年路867號1樓,賺起來運動彩券行,地圖
雲林縣,西螺鎮,雲林縣西螺鎮平和南路355號1樓,大利樂運動彩券行,地圖
雲林縣,東勢鄉,雲林縣東勢鄉東勢東路75號1樓,翔發運動彩券行,地圖
雲林縣,斗六市,雲林縣斗六市石榴路222-1號1樓,福貿運動彩券行,地圖
雲林縣,斗六市,雲林縣斗六市上海路265號1樓,好運運動彩券,地圖
雲林縣,斗南鎮,雲林縣斗南鎮延平路二段538號1樓,億贏運動彩券行,地圖
雲林縣,西螺鎮,雲林縣西螺鎮埔心路33號1樓,埔心運動彩券行,地圖
雲林縣,斗南鎮,雲林縣斗南鎮大同路23號1樓,鑫富運動彩券行,地圖
雲林縣,虎尾鎮,雲林縣虎尾鎮民族路105號1樓,勝利運動彩券投注站,地圖
雲林縣,虎尾鎮,雲林縣虎尾鎮民權路67號1樓,錢旺運動彩券行,地圖
雲林縣,斗六市,雲林縣斗六市成功路340號1樓,錢來來運動彩券行,地圖
雲林縣,西螺鎮,雲林縣西螺鎮中山路82號1樓,金永鑫運動彩券行,地圖
雲林縣,大埤鄉,雲林縣大埤鄉南和村南門街34號1樓,豐盛運動彩券行,地圖
雲林縣,斗南鎮,雲林縣斗南鎮大成路29號1樓,包好贏運動彩券行,地圖
雲林縣,斗南鎮,雲林縣斗南鎮中山路132號1樓,上贏錢運動彩券行,地圖
雲林縣,虎尾鎮,雲林縣虎尾鎮德興路7號1樓,上好贏運動彩券行,地圖
雲林縣,斗六市,雲林縣斗六市西平路451號1樓,加倍賺運動彩券行,地圖
雲林縣,北港鎮,雲林縣北港鎮文化路42之18、42之19號1樓,一定贏運動彩券行,地圖
雲林縣,斗南鎮,雲林縣斗南鎮延平路二段447號1樓,恩典運動彩券行,地圖
雲林縣,麥寮鄉,雲林縣麥寮鄉橋頭村橋頭158之1號1樓,橋頭全聯運動彩券行,地圖
雲林縣,斗南鎮,雲林縣斗南鎮大同路257號1樓,好好贏運動彩券行,地圖
新竹縣,新埔鎮,新竹縣新埔鎮中正路268號1樓,立即發運動彩券行,地圖
新竹縣,湖口鄉,新竹縣湖口鄉文化路105號1樓,祥龍運彩商行,地圖
新竹縣,竹北市,新竹縣竹北市自強五路72號1樓,全勝運動彩券行,地圖
新竹縣,新豐鄉,新竹縣新豐鄉泰安街180號1樓,益首發運動彩券行,地圖
新竹縣,新豐鄉,新竹縣新豐鄉建興路一段146之15號1樓,金福氣運動彩券行,地圖
新竹縣,新豐鄉,新竹縣新豐鄉道化街77號1樓,運大財運動彩券行,地圖
新竹縣,竹北市,新竹縣竹北市中正西路230號1樓,全勝發運動彩券行,地圖
新竹縣,竹北市,新竹縣竹北市中正東路138號1樓,錢錢愛我運動彩券行,地圖
新竹縣,湖口鄉,新竹縣湖口鄉鳳凰村中華路72號,通贏運動彩券行,地圖
新竹縣,湖口鄉,新竹縣湖口鄉文化路41號1樓,玩運彩運動彩券,地圖
新竹縣,竹東鎮,新竹縣竹東鎮中豐路二段102號1樓,希繁投注站,地圖
新竹縣,新豐鄉,新竹縣新豐鄉新興路167-7號1樓,錡發運動彩券行,地圖
新竹縣,竹東鎮,新竹縣竹東鎮長春路三段261號1樓,連贏投注站,地圖
新竹縣,竹東鎮,新竹縣竹東鎮長春路一段319號1樓,吉興旺運彩行,地圖
新竹縣,湖口鄉,新竹縣湖口鄉中山路二段201號1樓,發財神運彩行,地圖
新竹縣,芎林鄉,新竹縣芎林鄉文德路31號1樓,珮荃投注站,地圖
新竹縣,竹北市,新竹縣竹北市勝利一路166號1樓,金喜運動彩券行,地圖
新竹縣,竹東鎮,新竹縣竹東鎮東林路99號1樓,運動發投注站,地圖
新竹縣,竹北市,新竹縣竹北市民權街58號1樓,鑫富發運動彩券行,地圖
新竹縣,竹東鎮,新竹縣竹東鎮仁愛路253號1樓,孝恩投注站,地圖
新竹縣,湖口鄉,新竹縣湖口鄉工業一路29號1樓,爆米發運彩行,地圖
新竹縣,新埔鎮,新竹縣新埔鎮中正路718號1樓,關關過運動彩券行,地圖
新竹縣,湖口鄉,新竹縣湖口鄉新興路567號1樓,雙喜運動彩券行,地圖
新竹縣,竹東鎮,新竹縣竹東鎮北興路三段509號1樓,富寶金運彩行,地圖
新竹縣,竹北市,新竹縣竹北市福興東路二段58號1樓,明星運動彩券行,地圖
新竹縣,新豐鄉,新竹縣新豐鄉建興路一段85號1樓,添財旺運動彩券,地圖
新竹縣,新豐鄉,新竹縣新豐鄉中興路195號1樓,東方鼎立運動彩券行,地圖
新竹縣,湖口鄉,新竹縣湖口鄉民權街54-2號1樓,吉興運彩行,地圖
新竹縣,湖口鄉,新竹縣湖口鄉中正路一段3號1樓,中山大發運動彩券,地圖
新竹縣,湖口鄉,新竹縣湖口鄉仁和路139號1樓,仁和運動彩券行,地圖
新竹縣,竹北市,新竹縣竹北市中山路59號1樓,金倍湛運動彩券行,地圖
新竹縣,芎林鄉,新竹縣芎林鄉文衡路429號1樓,旺旺運彩商行,地圖
新竹縣,湖口鄉,新竹縣湖口鄉中正路一段35號1樓,滿荷包運彩商行,地圖
新竹縣,竹北市,新竹縣竹北市中山路12號1樓,六角鑫運動彩券,地圖
新竹縣,竹東鎮,新竹縣竹東鎮長春路二段128號1樓,發財旺運彩商行,地圖
新竹縣,湖口鄉,新竹縣湖口鄉中正路一段84號1樓,發玖玖運彩行,地圖
新竹縣,竹北市,新竹縣竹北市博愛街232號1樓,景順商行,地圖
新竹縣,竹北市,新竹縣竹北市華興街190號1樓,紅金寶商行,地圖
新竹縣,湖口鄉,新竹縣湖口鄉達生路128號1樓,飛錸發運彩商行,地圖
新竹縣,竹北市,新竹縣竹北市嘉興路302號1樓,來即發運動彩券行,地圖
新竹縣,竹北市,新竹縣竹北市中正東路276號1樓,金正旺商行,地圖
新竹縣,竹北市,新竹縣竹北市縣政二路83號1樓,享鉅財運動彩券行,地圖
新竹縣,北埔鄉,新竹縣北埔鄉北埔街58號1樓,連發中運彩商行,地圖
新竹縣,竹北市,新竹縣竹北市博愛街347號1樓,金好發運動彩券行,地圖
新竹縣,竹北市,新竹縣竹北市東興路一段941號1樓,億財運彩行,地圖
新竹縣,關西鎮,新竹縣關西鎮中山路37號1樓,金元寶運彩行,地圖
新竹縣,新豐鄉,新竹縣新豐鄉建興路二段821號1樓,旺民興運彩商行,地圖
新竹縣,竹東鎮,新竹縣竹東鎮東峰路26號1樓,包你發運動彩,地圖
新竹縣,竹北市,新竹縣竹北市博愛街204號1樓,過關達人運彩商行,地圖
新竹縣,寶山鄉,新竹縣寶山鄉雙園路二段415號1樓,金來發運彩商行,地圖
新竹縣,湖口鄉,新竹縣湖口鄉光復東路193號1樓,伍銡發運彩商行,地圖
新竹縣,竹北市,新竹縣竹北市博愛街503號1樓,財神降臨運動彩券行,地圖
新竹縣,湖口鄉,新竹縣湖口鄉文化路66號1樓,金福星運動彩券行,地圖
新竹縣,竹北市,新竹縣竹北市光明三路30號1樓,踴躍運動彩券行,地圖
新竹縣,竹東鎮,新竹縣竹東鎮龍鳳路1號1樓,大獲全勝運動彩券行,地圖
新竹縣,湖口鄉,新竹縣湖口鄉民富街15號1樓,金多錢運動彩券行,地圖
新竹縣,竹東鎮,新竹縣竹東鎮大同路101號1樓,勝利一零一投注站,地圖
新竹縣,湖口鄉,新竹縣湖口鄉仁和路99號1樓,飛來發運彩商行,地圖
苗栗縣,苗栗市,苗栗縣苗栗市自治路389號1樓,太旺了運彩行,地圖
苗栗縣,竹南鎮,苗栗縣竹南鎮民族街35號1樓,冠軍之家運動彩券行,地圖
苗栗縣,通霄鎮,苗栗縣通霄鎮中正路38號1樓,就是贏運動彩券,地圖
苗栗縣,頭份市,苗栗縣頭份市中華路1083號1樓,必勝運動彩券行,地圖
苗栗縣,竹南鎮,苗栗縣竹南鎮中華路133號1樓,萊就發運動彩券行,地圖
苗栗縣,通霄鎮,苗栗縣通霄鎮福德路77號1樓,達千倍運動彩券行,地圖
苗栗縣,竹南鎮,苗栗縣竹南鎮和平街106號1樓,有球必贏投注站,地圖
苗栗縣,頭份市,苗栗縣頭份市建國路二段314號1樓,銓發運動彩券行,地圖
苗栗縣,銅鑼鄉,苗栗縣銅鑼鄉中正路185號1樓,保大獎運動商行,地圖
苗栗縣,後龍鎮,苗栗縣後龍鎮中華路154之5號1樓,鴻吉運動彩券行,地圖
苗栗縣,苑裡鎮,苗栗縣苑裡鎮和平路13號1樓,贏千倍運動彩券行,地圖
苗栗縣,苑裡鎮,苗栗縣苑裡鎮中正里中正102之21號1樓,王子運彩投注站,地圖
苗栗縣,苗栗市,苗栗縣苗栗市忠孝路7號1樓,金穩贏運動彩券行,地圖
苗栗縣,竹南鎮,苗栗縣竹南鎮博愛街88號,來得富彩券行,地圖
苗栗縣,頭份市,苗栗縣頭份市中正路223之1號,包贏運動彩券行,地圖
苗栗縣,竹南鎮,苗栗縣竹南鎮龍山路二段47號1樓,包金運動彩券行,地圖
苗栗縣,竹南鎮,苗栗縣竹南鎮光復路242號1樓,樂樂發運動彩券行,地圖
苗栗縣,竹南鎮,苗栗縣竹南鎮仁愛路673號1樓,睿嶸彩券行,地圖
苗栗縣,頭份市,苗栗縣頭份市建國路201號1樓,大聯盟運動投注站,地圖
