縣市,行政區,地址,投注站名稱,Google 地圖連結
高雄市,三民區,高雄市三民區平等路97號1樓,滿分運動彩券行,地圖
高雄市,新興區,高雄市新興區八德一路271號1樓,熊發財商行,地圖
高雄市,三民區,高雄市三民區澄和路99號1樓,貴關運動彩券行,地圖
高雄市,左營區,高雄市左營區左營大路167號1樓,煌尚運動彩券行,地圖
高雄市,左營區,高雄市左營區自由三路335號1樓,鑫彩虹運動彩券行,地圖
高雄市,三民區,高雄市三民區天祥一路129號1樓,金生水運動彩券行,地圖
高雄市,三民區,高雄市三民區陽明路106號1樓,運興旺彩券行,地圖
高雄市,三民區,高雄市三民區建工路741號1樓,金緣運動彩券行,地圖
高雄市,三民區,高雄市三民區正興里興昌街83巷15號1樓,興昌滿貫砲運動彩券行,地圖
高雄市,前金區,高雄市前金區中華三路246號1樓,真好過運動彩券行,地圖
高雄市,楠梓區,高雄市楠梓區德賢路222號1樓,德賢運動商行,地圖
高雄市,左營區,高雄市左營區榮佑路67號1樓,一球可吉運動彩券行,地圖
高雄市,三民區,高雄市三民區建興路293號1樓,金大富運動彩券行,地圖
高雄市,三民區,高雄市三民區熱河一街382號1樓,金贏面運動彩券行,地圖
高雄市,三民區,高雄市三民區建興路341號1樓,冠盈運動商行,地圖
高雄市,三民區,高雄市三民區明仁路14號1樓,優勝運動彩券行,地圖
高雄市,三民區,高雄市三民區裕誠路102號1樓,吉家運動彩券行,地圖
高雄市,左營區,高雄市左營區崇德路399號1樓,好萊富運動彩券行,地圖
高雄市,鼓山區,高雄市鼓山區明倫路442號1樓,球鑫運動彩券行,地圖
高雄市,新興區,高雄市新興區和平一路283號1樓,旺客來運動商行,地圖
高雄市,三民區,高雄市三民區建工路571號1樓,金雙贏運動彩券行,地圖
高雄市,左營區,高雄市左營區新庄仔路542號1樓,財滾滾運動彩券行,地圖
高雄市,楠梓區,高雄市楠梓區三山街2號1樓,鉑聖運動彩券行,地圖
高雄市,鼓山區,高雄市鼓山區九如四路702號1樓,鑫泰豐彩券行,地圖
高雄市,新興區,高雄市新興區六合路88號1樓,福特波運動彩券行,地圖
高雄市,楠梓區,高雄市楠梓區樂群路63號1樓,中華運動彩券行,地圖
高雄市,左營區,高雄市左營區自由四路327號1樓,全麥運動彩券行,地圖
高雄市,鼓山區,高雄市鼓山區臨海二路23號1樓,神保佑運動彩券行,地圖
高雄市,新興區,高雄市新興區復興一路70之16號1樓,王者運動彩券行,地圖
高雄市,左營區,高雄市左營區富國路226號1樓,老地方運動彩券行,地圖
高雄市,左營區,高雄市左營區華夏路1267號1樓,黃金腿運動彩券行,地圖
高雄市,楠梓區,高雄市楠梓區後昌路43號1樓,非過不可商行,地圖
高雄市,前金區,高雄市前金區自強三路242號1樓,容易過運動彩券行,地圖
高雄市,楠梓區,高雄市楠梓區惠民路118號1樓,晴天運動彩券行,地圖
高雄市,楠梓區,高雄市楠梓區清豐路211號1樓,鈜運運動彩券行,地圖
高雄市,鼓山區,高雄市鼓山區濱海二路2號1樓,來吧發運動彩券行,地圖
高雄市,三民區,高雄市三民區山東街103號1樓,名人堂運動彩券行,地圖
高雄市,鼓山區,高雄市鼓山區華榮路93號1樓,承旺運動彩券行,地圖
高雄市,楠梓區,高雄市楠梓區後昌路161號1樓,後昌運動商行,地圖
高雄市,左營區,高雄市左營區左營大路300號1樓,攏來中運動彩券行,地圖
高雄市,三民區,高雄市三民區義華路363號1樓,過關發運動彩券行,地圖
高雄市,三民區,高雄市三民區大豐二路353號1樓,億中運動彩券,地圖
高雄市,三民區,高雄市三民區覺民路199號1樓,連過運動彩券行,地圖
高雄市,鼓山區,高雄市鼓山區華榮路558號1樓,鑫皇運動彩券行,地圖
高雄市,三民區,高雄市三民區大昌一路71號1樓,精英運動彩券行,地圖
高雄市,楠梓區,高雄市楠梓區德祥路173號1樓,睏霸領錢運動彩券行,地圖
高雄市,楠梓區,高雄市楠梓區後昌路859號1樓,銓過關運動彩券行,地圖
高雄市,三民區,高雄市三民區大豐二路297號1樓,甄盈運動彩券行,地圖
高雄市,三民區,高雄市三民區瀋陽街133號1樓,揪熱血運動彩券行,地圖
高雄市,左營區,高雄市左營區果峰街39號1樓,金佳旺運動彩券行,地圖
高雄市,楠梓區,高雄市楠梓區德祥路89號1樓,金正賀運動商行,地圖
高雄市,前金區,高雄市前金區自強一路61號1樓,羅納多運動彩券行,地圖
高雄市,三民區,高雄市三民區嫩江街74號1樓,強擊者運動彩券行,地圖
高雄市,楠梓區,高雄市楠梓區樂群路188號1樓,攏來贏錢運動彩券行,地圖
高雄市,三民區,高雄市三民區覺民路598號1樓,鈺修彩券行,地圖
高雄市,三民區,高雄市三民區大昌二路216號1樓,鑫球贏彩券行,地圖
高雄市,左營區,高雄市左營區店仔頂路27號1樓,串關王運動彩券行,地圖
高雄市,楠梓區,高雄市楠梓區瑞屏路10號1樓,貞雄運動彩券行,地圖
高雄市,鼓山區,高雄市鼓山區南屏路534號1樓,金泰旺運動彩券行,地圖
高雄市,左營區,高雄市左營區崇德路259號1樓,全面過運動彩券行,地圖
高雄市,三民區,高雄市三民區鼎中路725號1樓,百面過運動彩券行,地圖
高雄市,左營區,高雄市左營區富國路341號1樓,攏貴啦運動彩券行,地圖
高雄市,新興區,高雄市新興區林森一路163之4號1樓,百營運動彩券行,地圖
高雄市,楠梓區,高雄市楠梓區旗楠路891之1號1樓,旗楠運動商行,地圖
高雄市,左營區,高雄市左營區左營大路419號1樓,火狐狸運動彩券行,地圖
高雄市,新興區,高雄市新興區復興一路4之5號1樓,輝仁運動彩券行,地圖
高雄市,左營區,高雄市左營區富國路428之1號1樓,貴富運動彩券行,地圖
高雄市,三民區,高雄市三民區熱河二街115號1樓,巴賽隆納彩券行,地圖
高雄市,楠梓區,高雄市楠梓區德民路356巷30號之18(1樓),德民運動商行,地圖
高雄市,左營區,高雄市左營區文自路292號1樓,很會踢運動彩券行,地圖
高雄市,三民區,高雄市三民區有光路114號1樓,金勝運動彩券行,地圖
高雄市,新興區,高雄市新興區六合一路39之10號1樓,佳興旺運動彩券行,地圖
高雄市,三民區,高雄市三民區大豐一路367號1樓,晟功運動彩券行,地圖
高雄市,鼓山區,高雄市鼓山區裕興路105號1樓,鑫寶運動彩券行,地圖
高雄市,三民區,高雄市三民區大豐二路496號1樓,金吉祥運動商行,地圖
高雄市,三民區,高雄市三民區九如二路524號1樓,龍鳳運動彩券行,地圖
高雄市,三民區,高雄市三民區北平一街119號1樓,百面贏商行,地圖
高雄市,鼓山區,高雄市鼓山區青海路287號1樓,貴冠運動彩券行,地圖
高雄市,新興區,高雄市新興區林森一路145號1樓,梅西運動彩券行,地圖
高雄市,左營區,高雄市左營區重信路551號1樓,宇旺運動彩券行,地圖
高雄市,前金區,高雄市前金區自立一路15號1樓,逢買必贏彩券行,地圖
高雄市,三民區,高雄市三民區建工路564號1樓,金豪贏運動彩券行,地圖
高雄市,三民區,高雄市三民區建工路306號1樓,贏過面運動彩券行,地圖
高雄市,左營區,高雄市左營區後昌路719號1樓,有心運動彩券行,地圖
高雄市,左營區,高雄市左營區華夏路1765號1樓,泰榮億運動彩券行,地圖
高雄市,楠梓區,高雄市楠梓區建楠路224號1樓,鑫吉富運動彩券行,地圖
高雄市,三民區,高雄市三民區鼎山街594號1樓,宏利運動彩券行,地圖
高雄市,左營區,高雄市左營區富國路110號1樓,金滾滾運動彩券行,地圖
高雄市,三民區,高雄市三民區鼎力路262號1樓,全通財運動彩券行,地圖
高雄市,鼓山區,高雄市鼓山區華榮路201號1樓,金好贏運動彩券行,地圖
高雄市,前金區,高雄市前金區中華三路220之1號1樓,富萬千運動彩券行,地圖
高雄市,三民區,高雄市三民區復興一路157號1樓,鑫展運動彩券行,地圖
高雄市,三民區,高雄市三民區大昌二路46號1樓,好神運動彩券行,地圖
高雄市,左營區,高雄市左營區左營大路78號1樓,順旺運動彩券行,地圖
高雄市,新興區,高雄市新興區六合一路188號1樓,財好旺運動彩券行,地圖
高雄市,左營區,高雄市左營區富民路277號1樓,有錢多多運動彩券行,地圖
高雄市,三民區,高雄市三民區澄和路91號1樓,奔跑吧運動彩券行,地圖
高雄市,左營區,高雄市左營區左營大路401巷43弄6號1樓,詠順運動彩券行,地圖
高雄市,左營區,高雄市左營區富國路96號1樓,鑫昇運動彩券行,地圖
高雄市,左營區,高雄市左營區自由三路278號1樓,金禾運動彩券行,地圖
高雄市,楠梓區,高雄市楠梓區楠都東街127號1樓,金來來運動商行,地圖
高雄市,三民區,高雄市三民區大豐二路138號1樓,泉富運動彩券行,地圖
高雄市,三民區,高雄市三民區文濱路70號1樓,億升運動彩券行,地圖
高雄市,左營區,高雄市左營區富國路137號1樓,全方位運動彩券行,地圖
高雄市,三民區,高雄市三民區大豐二路344號1樓,貝斯凱波運動彩券行,地圖
高雄市,左營區,高雄市左營區左營大路14號1樓,短跑甜心運動彩券行,地圖
高雄市,左營區,高雄市左營區崇德路270號1樓,鬥陣贏運動彩券行,地圖
高雄市,前金區,高雄市前金區六合二路111之2號1樓,勁動力活力運動彩券行,地圖
高雄市,新興區,高雄市新興區青年一路208號1樓,勁來興運動彩券行,地圖
高雄市,前金區,高雄市前金區自強三路215號1樓,精準度運動彩券行,地圖
高雄市,鼓山區,高雄市鼓山區九如四路1133號1樓,佬地方運動彩券行,地圖
高雄市,三民區,高雄市三民區鼎山街227號1樓,晟發運彩行,地圖
高雄市,左營區,高雄市左營區左營大路277之1號1樓,興達運動彩券行,地圖
高雄市,三民區,高雄市三民區鼎中路242號1樓,強發運彩行,地圖
高雄市,前金區,高雄市前金區新田路206號1樓,神旺運動彩券行,地圖
高雄市,三民區,高雄市三民區覺民路564號1樓,常常贏運動彩券行,地圖
高雄市,楠梓區,高雄市楠梓區興楠路71號1樓,達哥運動彩券行,地圖
高雄市,茄萣區,高雄市茄萣區仁愛路三段222號1樓,鑫來贏運動彩券,地圖
高雄市,岡山區,高雄市岡山區壽天路122號1樓,直直過商行,地圖
高雄市,鳳山區,高雄市鳳山區鳳北路46號1樓,金鑫發運動彩券行,地圖
高雄市,路竹區,高雄市路竹區中正路108號1樓,百發百中商行,地圖
高雄市,林園區,高雄市林園區林園北路316號1樓,穩過關運動彩券行,地圖
高雄市,仁武區,高雄市仁武區仁武里中華路55號1樓,金幸運運動彩券行,地圖
高雄市,岡山區,高雄市岡山區嘉興路173號1樓,金探吉運動彩券行,地圖
高雄市,路竹區,高雄市路竹區社西里21鄰大社路69號1樓,貞會中運動彩券行,地圖
高雄市,大樹區,高雄市大樹區久堂里久堂路152號1樓,金福興企業運動彩券行,地圖
高雄市,鳳山區,高雄市鳳山區南榮路266號1樓,鑽多多運動彩券行,地圖
高雄市,仁武區,高雄市仁武區仁雄路11之2號1樓,仁熊運動彩券行,地圖
高雄市,鳥松區,高雄市鳥松區仁美里學堂路111號1樓,金財運運動商行,地圖
高雄市,鳳山區,高雄市鳳山區自強二路1號、1之1號1樓,紅牛運動彩券行,地圖
高雄市,仁武區,高雄市仁武區仁雄路143號1樓,立吉中運動彩券行,地圖
高雄市,岡山區,高雄市岡山區大仁北路202號1樓,佳采彩券行,地圖
高雄市,鳳山區,高雄市鳳山區自強二路98號1樓,正港厲害商行,地圖
高雄市,鳳山區,高雄市鳳山區自強二路248號1樓,大聯盟旺力運動彩券行,地圖
高雄市,大寮區,高雄市大寮區八德路60號1樓,金興旺運動商行,地圖
高雄市,鳳山區,高雄市鳳山區鳳松路1之5號1樓,二刀流運動彩券行,地圖
高雄市,湖內區,高雄市湖內區保生路378號1樓,路鑫彩券行,地圖
高雄市,鳳山區,高雄市鳳山區八德路348號1樓,東豐運動彩券行,地圖
高雄市,仁武區,高雄市仁武區仁和街6號1樓,百面中運動彩券經銷業,地圖
高雄市,岡山區,高雄市岡山區民有路22號1樓,全民運動彩券行,地圖
高雄市,湖內區,高雄市湖內區信義路354號1樓,福來喜運動彩券行,地圖
高雄市,岡山區,高雄市岡山區柳橋東路71號1樓,年少夢運動彩券行,地圖
高雄市,鳳山區,高雄市鳳山區南榮路89號1樓,來樂彩券行,地圖
高雄市,大樹區,高雄市大樹區中興北路8號1樓,佳佳運動商行,地圖
高雄市,鳳山區,高雄市鳳山區中山西路343號1樓,全明星運動彩券行,地圖
高雄市,鳳山區,高雄市鳳山區杭州西街125號1樓,福氣來運動商行,地圖
高雄市,鳳山區,高雄市鳳山區五甲三路31號,樂和商行,地圖
高雄市,鳳山區,高雄市鳳山區三商街57號1樓,富金運動彩券行,地圖
高雄市,仁武區,高雄市仁武區仁雄路69之1號1樓,喬丹運動彩券行,地圖
高雄市,鳳山區,高雄市鳳山區八德路266號1樓,勝利玩家運動彩券行,地圖
高雄市,鳳山區,高雄市鳳山區大明路62號1樓,小飛象運動彩券行,地圖
高雄市,仁武區,高雄市仁武區中華路133號1樓,運來發運動彩券,地圖
高雄市,岡山區,高雄市岡山區公園西路三段97號1樓,金穩住運動彩券行,地圖
高雄市,鳳山區,高雄市鳳山區中山路163號1樓,滿滿發運動彩券行,地圖
高雄市,梓官區,高雄市梓官區港七街73號1樓,得分運動彩券行,地圖
高雄市,旗山區,高雄市旗山區中山路149號1樓,晶英運動彩券行,地圖
高雄市,鳳山區,高雄市鳳山區大明路53之1號1樓,勢必贏運彩行,地圖
高雄市,大社區,高雄市大社區中山路307號1樓,熊福氣商行,地圖
高雄市,旗山區,高雄市旗山區延平一路682號1樓,喜來旺運動彩券行,地圖
高雄市,仁武區,高雄市仁武區仁勇路83號1樓,俊銘運動彩券行,地圖
高雄市,鳳山區,高雄市鳳山區中山路203號1樓,站前運動彩券行,地圖
高雄市,鳳山區,高雄市鳳山區青年路二段398號1樓,時來運轉運動彩券行,地圖
高雄市,鳳山區,高雄市鳳山區光復路一段42號1樓,福爾摩沙運動彩券行,地圖
高雄市,大寮區,高雄市大寮區鳳林三路67號1樓,紅人榜運動彩券,地圖
高雄市,鳳山區,高雄市鳳山區文化西路9號1樓,頭等艙運動彩券行,地圖
高雄市,鳳山區,高雄市鳳山區光復路一段9號1樓,品旺運彩行,地圖
高雄市,岡山區,高雄市岡山區壽華路82號1樓,富玉家財神運動彩券行,地圖
高雄市,鳳山區,高雄市鳳山區八德路267之1號1樓,過關斬將運動彩券行,地圖
高雄市,鳳山區,高雄市鳳山區五甲一路61號1樓,金正旺運動商行,地圖
高雄市,鳳山區,高雄市鳳山區八德路268號1樓,金速希運動彩券行,地圖
高雄市,燕巢區,高雄市燕巢區中興路32號1樓,采旺運動彩券行,地圖
高雄市,鳳山區,高雄市鳳山區新富路502號1樓,五湖四海運彩行,地圖
高雄市,路竹區,高雄市路竹區國昌路39號1樓,龍青運動彩券行,地圖
高雄市,仁武區,高雄市仁武區中正路87號1樓,富野運動彩券行,地圖
高雄市,岡山區,高雄市岡山區岡燕路371號1樓,金順利運動彩券,地圖
高雄市,岡山區,高雄市岡山區平和路47號1樓,金福滿堂,地圖
高雄市,燕巢區,高雄市燕巢區中興路86號1樓,水寶彩券行,地圖
高雄市,鳳山區,高雄市鳳山區五甲一路53之6號1樓,尚旺運彩行,地圖
高雄市,大寮區,高雄市大寮區大寮路853號1樓,大發發運動彩券行,地圖
高雄市,鳳山區,高雄市鳳山區建國路三段207號1樓,金福鑫商行,地圖
高雄市,仁武區,高雄市仁武區八德中路116號1樓,水多多一彩券行,地圖
高雄市,大社區,高雄市大社區中山路461號1樓,皇金運動彩券行,地圖
高雄市,仁武區,高雄市仁武區仁忠路13號1樓,仁忠運動商行,地圖
高雄市,鳳山區,高雄市鳳山區鳳松路74號1樓,球神運動彩券行,地圖
高雄市,大寮區,高雄市大寮區大寮路877號1樓,金正鑫運動商行,地圖
高雄市,鳳山區,高雄市鳳山區光復路116號1樓,金福來運動商行,地圖
高雄市,阿蓮區,高雄市阿蓮區中正路405號1樓,來呀運動彩券行,地圖
高雄市,鳳山區,高雄市鳳山區五甲二路527號1樓,客多多商行,地圖
高雄市,梓官區,高雄市梓官區大舍東路16號1樓,金財神彩券行,地圖
高雄市,鳳山區,高雄市鳳山區中華街39號1樓,鑫佰億企業社,地圖
高雄市,鳳山區,高雄市鳳山區海洋一路128號1樓,好事多多運動彩券行,地圖
高雄市,大樹區,高雄市大樹區中興東路75號1樓,大富運動彩券行,地圖
高雄市,鳳山區,高雄市鳳山區凱旋路306號1樓,眾財運動彩券行,地圖
高雄市,湖內區,高雄市湖內區保生路346之3號1樓,台灣金封王運動彩券行,地圖
高雄市,大社區,高雄市大社區翠屏路1號1樓,水發彩券行,地圖
高雄市,大寮區,高雄市大寮區鳳林三路613號1樓,威財來彩券行,地圖
高雄市,鳳山區,高雄市鳳山區青年路二段490號1樓,喜不完商行,地圖
高雄市,鳳山區,高雄市鳳山區光復路一段69號1樓,喜金欸商行,地圖
高雄市,大寮區,高雄市大寮區山頂路152號1樓,凱貴商行,地圖
高雄市,仁武區,高雄市仁武區仁雄路73-8號1樓,傳奇英雄運動彩券行,地圖
高雄市,鳥松區,高雄市鳥松區本館路92之8號1樓,金來贏運動彩券行,地圖
高雄市,大社區,高雄市大社區中山路12號1樓,兆過運動彩券行,地圖
高雄市,鳳山區,高雄市鳳山區中崙二路489號1樓,吉利中崙運動商行,地圖
高雄市,林園區,高雄市林園區東林西路104號1樓,錢都多商行,地圖
高雄市,鳳山區,高雄市鳳山區中山路6號,龍山旺活力運動彩券行,地圖
高雄市,仁武區,高雄市仁武區澄合街211號1樓,全壘打運動彩券行,地圖
高雄市,鳳山區,高雄市鳳山區中山路137號1樓,旺億運動彩券行,地圖
高雄市,岡山區,高雄市岡山區介壽西路63號1樓,鴻韻運動彩券行,地圖
高雄市,阿蓮區,高雄市阿蓮區中正路438號1樓,金大滿貫運動彩券行,地圖
高雄市,橋頭區,高雄市橋頭區成功南路43號1樓,水多多旺彩券行,地圖
高雄市,鳳山區,高雄市鳳山區林森路83號1樓,樂哈哈商行,地圖
高雄市,鳳山區,高雄市鳳山區青年路二段199號1樓,喜開懷商行,地圖
高雄市,美濃區,高雄市美濃區中正路一段49號1樓,喜氣運動彩券行,地圖
高雄市,橋頭區,高雄市橋頭區隆豐路256號1樓,吉順運動彩券行,地圖
高雄市,林園區,高雄市林園區東林西路109-1號1樓,錢攏來彩券行,地圖
高雄市,林園區,高雄市林園區仁愛路36號1樓,鑫彩發運動彩券行,地圖
高雄市,鳳山區,高雄市鳳山區五甲一路135號1樓,富來發運動彩券行,地圖
高雄市,旗山區,高雄市旗山區華中街20號1樓,金多發運動彩券行,地圖
高雄市,路竹區,高雄市路竹區大社路198號1樓,路竹最旺運動彩券行,地圖
高雄市,大社區,高雄市大社區中山路136號1樓,富盟運動彩券行,地圖
高雄市,大寮區,高雄市大寮區大寮路509號1樓,樂鑨運動彩券行,地圖
高雄市,岡山區,高雄市岡山區大德一路37號1樓,宇宙運動彩券行,地圖
高雄市,大寮區,高雄市大寮區中正路3之2號1樓,金正讚運動彩券行,地圖
高雄市,鳳山區,高雄市鳳山區武營路192號1樓,旺來富活力運動彩券行,地圖
高雄市,仁武區,高雄市仁武區永仁街245號1樓,好運氣運動彩券行,地圖
高雄市,鳳山區,高雄市鳳山區海洋二路118號1樓,金豪運運動彩券行,地圖
高雄市,鳳山區,高雄市鳳山區南華路91號1樓,勁南華運動彩券行,地圖
高雄市,茄萣區,高雄市茄萣區仁愛路三段226號1樓,財富金旺運動彩券行,地圖
高雄市,林園區,高雄市林園區林園北路501號1樓,運通運動彩券行,地圖
高雄市,鳳山區,高雄市鳳山區鳳松路360號1樓,必贏運動彩券行,地圖
高雄市,鳳山區,高雄市鳳山區自強二路96號1樓,正港好中商行,地圖
高雄市,鳳山區,高雄市鳳山區五甲二路671號1樓,時來運轉商行,地圖
高雄市,鳳山區,高雄市鳳山區中崙四路2號1樓,金牌運動彩券行,地圖
高雄市,美濃區,高雄市美濃區中正路一段60號1樓,金來財運動彩券行,地圖
高雄市,路竹區,高雄市路竹區中華路84號1樓,福運連連運動彩券行,地圖
高雄市,旗山區,高雄市旗山區延平一路655之2號1樓,旗開得勝商行,地圖
高雄市,茄萣區,高雄市茄萣區忠孝街142-7號1樓,億萬運動彩券行,地圖
台中市,北區,台中市北區進化北路146號1樓,甘肅財神運動彩券行,地圖
台中市,西屯區,台中市西屯區大鵬路37號1樓,強棒運動彩券行,地圖
台中市,西屯區,台中市西屯區西屯路三段159之10之6號1樓,金財庫運動彩券行,地圖
台中市,北屯區,台中市北屯區太原路三段167號1樓,豪駿運動彩券行,地圖
台中市,北區,台中市北區北平路二段125號1樓,麒勝運動彩券行,地圖
台中市,北區,台中市北區永興街96號1樓,奪冠王運動彩券行,地圖
台中市,北區,台中市北區北平路二段169號1樓,呈銀嘉運動彩券,地圖
台中市,西屯區,台中市西屯區福雅路137巷1號1樓,惠中千百億運動彩券行,地圖
台中市,西屯區,台中市西屯區上安路60-1號1樓,博贏商行,地圖
台中市,西屯區,台中市西屯區西屯路二段320號1樓,中工財神運動彩券行,地圖
台中市,北區,台中市北區健行路580號1樓,泰穩運動彩券行,地圖
台中市,北區,台中市北區三民路三段253號,炫富運彩館,地圖
台中市,西屯區,台中市西屯區大隆路147號1樓,金連發運動彩券行,地圖
台中市,北區,台中市北區進化路423號1樓,樂財堡運動彩券行,地圖
台中市,北屯區,台中市北屯區東山路一段369之15號1樓,金崍發運動彩券,地圖
台中市,北屯區,台中市北屯區四平路260號1樓,長鴻運動彩券行,地圖
台中市,西屯區,台中市西屯區福順路306號1樓,金福順運動彩券行,地圖
台中市,西屯區,台中市西屯區河南路二段76號1樓,錢來富運動彩券行,地圖
台中市,北屯區,台中市北屯區同榮路163號1樓,一六三運動彩券行,地圖
台中市,西屯區,台中市西屯區福星路226號1樓,金達旺運動彩券行,地圖
台中市,北屯區,台中市北屯區山西路二段246號1樓,陽光運動彩券行,地圖
台中市,北屯區,台中市北屯區昌平路二段1-18號1樓,源泰運動彩券行,地圖
台中市,西屯區,台中市西屯區長安路二段132-1號1樓,百發百中運動行,地圖
台中市,北屯區,台中市北屯區大連路三段86號1樓,永福運動彩券行,地圖
台中市,北屯區,台中市北屯區大連路三段28號1樓,為鑫運動彩券行,地圖
台中市,北區,台中市北區進化北路111號1樓,蓁蓁運動彩券行,地圖
台中市,北區,台中市北區西屯路一段347-2號1樓,北區財財運動彩券行,地圖
台中市,北屯區,台中市北屯區敦化路一段459號1樓,億直贏運動彩券行,地圖
台中市,北屯區,台中市北屯區興安路一段246號1樓,金賈旺運動彩券行,地圖
台中市,北區,台中市北區中清路一段13號1樓,祥發運動彩券行,地圖
台中市,北區,台中市北區太平路105號1樓,樂福運動彩券行,地圖
台中市,西屯區,台中市西屯區西屯路二段2號1樓,招財喵運動彩券,地圖
台中市,北區,台中市北區中清路一段29號1樓,錢旺旺運動彩券,地圖
台中市,西屯區,台中市西屯區重慶路161號1樓,天水運動彩券行,地圖
台中市,西屯區,台中市西屯區漢口路一段151號1樓,歡喜來運動彩券,地圖
台中市,西屯區,台中市西屯區福科路927號1樓,真旺運動彩券行,地圖
台中市,北屯區,台中市北屯區大鵬路22號1樓,纓纓美黛子運動彩券行,地圖
台中市,西屯區,台中市西屯區河南路二段476號1樓,金鑽石運動彩券,地圖
台中市,西屯區,台中市西屯區黎明路三段427號1樓,紅心運動彩券行,地圖
台中市,北區,台中市北區民權路472-2號1樓,一值轟運動彩券行,地圖
台中市,西屯區,台中市西屯區朝富路266號1樓,台中七期運動彩券行,地圖
台中市,西屯區,台中市西屯區福雅路101號1樓,寶健運動彩券行,地圖
台中市,北區,台中市北區健行路867號1樓,泳昌運彩行,地圖
台中市,北屯區,台中市北屯區瀋陽路三段348號1樓,多進富運動彩券行,地圖
台中市,北區,台中市北區北平路二段40號1樓,山冠王投注站,地圖
台中市,西屯區,台中市西屯區成都路229號1樓,二二九運動彩券行,地圖
台中市,北區,台中市北區篤行路214號1樓,總盈運動彩券行,地圖
台中市,西屯區,台中市西屯區西屯路二段259-7號1樓,明星運動彩券行,地圖
台中市,西屯區,台中市西屯區福星路640號1樓,鑫福星運動彩券商行,地圖
台中市,西屯區,台中市西屯區長安路二段159號1樓,西屯世界杯線上投注運動彩券,地圖
台中市,北屯區,台中市北屯區北屯路293號1樓,太祖運動彩券行,地圖
台中市,北屯區,台中市北屯區崇興路一段30號1樓,龍易發運動彩券行,地圖
