縣市,行政區,地址,投注站名稱,Google 地圖連結
台南市,北區,台南市北區和緯路五段42號1樓,大撈家運動彩券,地圖
台南市,安南區,台南市安南區安和路一段171號1樓,好球運彩行,地圖
台南市,北區,台南市北區公園路563號1樓,九點二億彩券行,地圖
台南市,安平區,台南市安平區慶平路398號1樓,金滿貫運彩行,地圖
台南市,安平區,台南市安平區郡平路141號1樓,鋒碩運動彩券,地圖
台南市,安南區,台南市安南區同安路150號1樓,騰展彩券行,地圖
台南市,安南區,台南市安南區安中路一段848號1樓,安啦穩中運動彩券行,地圖
台南市,北區,台南市北區西門路四段371號1樓,滿貫發運動彩券,地圖
台南市,北區,台南市北區育德路446號1樓,強棒出擊運動彩券行,地圖
台南市,安南區,台南市安南區怡安路二段198號1樓,樂透運動彩券,地圖
台南市,東區,台南市東區崇善路372號1樓,好運爆棚運動彩券,地圖
台南市,東區,台南市東區自由路三段322號1樓,敬誠運動彩券行,地圖
台南市,中西區,台南市中西區健康路一段272號1樓,馬力夯運動彩券,地圖
台南市,北區,台南市北區北安路一段53號1樓,趙公明運動彩券行,地圖
台南市,北區,台南市北區武聖路66號1樓,浩勝彩券行,地圖
台南市,安平區,台南市安平區健康三街193號1樓,最會贏運動彩券行,地圖
台南市,南區,台南市南區新孝路34號1樓,采神運動彩券行,地圖
台南市,東區,台南市東區裕農路88號1樓,國明運動彩券行,地圖
台南市,安南區,台南市安南區安和路一段116號1樓,大慶運動彩券行,地圖
台南市,南區,台南市南區新興路507號,晶好中彩券行,地圖
台南市,北區,台南市北區開元路146號1樓,場場過運動彩券行,地圖
台南市,東區,台南市東區崇善路833號1樓,喜來旺運動彩券行,地圖
台南市,南區,台南市南區永華路一段253號1樓,永冠王彩券行,地圖
台南市,安南區,台南市安南區安中路一段717號1樓,錢家樂運彩行,地圖
台南市,東區,台南市東區中華東路二段207號1樓,大世紀運動彩券行,地圖
台南市,中西區,台南市中西區金華路四段122號1樓,金揚運動彩券行,地圖
台南市,南區,台南市南區金華路二段287號1樓,南霸天運動彩券行,地圖
台南市,東區,台南市東區東寧路298號1樓,連贏發運動彩券行,地圖
台南市,北區,台南市北區武聖路146號1樓,祥榮運彩生活館,地圖
台南市,北區,台南市北區開元路297號1樓,金欣運動彩券行,地圖
台南市,東區,台南市東區怡東路41號1樓,怡定贏運動彩券行,地圖
台南市,北區,台南市北區文賢路723號1樓,金手套運動彩券,地圖
台南市,東區,台南市東區榮譽街121之7號1樓,大力士運動彩券行,地圖
台南市,南區,台南市南區灣裡路390號1樓,元喜運動彩券行,地圖
台南市,中西區,台南市中西區大埔街34號1樓,允發財運動彩券,地圖
台南市,南區,台南市南區金華路一段307號1樓,豪贏運彩行,地圖
台南市,東區,台南市東區崇德路469號1樓,叭噗車車彩券行,地圖
台南市,南區,台南市南區金華路二段445號1樓,隆允贏運動彩券行,地圖
台南市,南區,台南市南區西門路一段307號1樓,好棒運動彩券,地圖
台南市,中西區,台南市中西區民族路三段290號1樓,艾佛森運動彩券,地圖
台南市,東區,台南市東區崇德路536號1樓,鑫旺勝運動彩券行,地圖
台南市,南區,台南市南區文南路120號1樓,金錢爆運動彩券行,地圖
台南市,安南區,台南市安南區安和路五段341號1樓,超幸運運動彩券行,地圖
台南市,安南區,台南市安南區安中路一段767號1樓,穩過關運動彩券,地圖
台南市,安平區,台南市安平區安平路726號1樓,動感鈔人運動彩券,地圖
台南市,北區,台南市北區長榮路五段18號1樓,新勝運動彩券,地圖
台南市,安平區,台南市安平區華平路692號1樓,安平最強運動彩券行,地圖
台南市,北區,台南市北區北成路397號1樓,九千倍運動彩券行,地圖
台南市,北區,台南市北區育德路338號1樓,打通關運動彩券行,地圖
台南市,安南區,台南市安南區北安路二段457號1樓,聯勝彩券行,地圖
台南市,南區,台南市南區新興路477號1樓,地球上投運動彩券,地圖
台南市,東區,台南市東區林森路二段192巷24弄25號1樓,明欣運動彩券行,地圖
台南市,東區,台南市東區崇明路97號1樓,金勾杯運動彩券,地圖
台南市,北區,台南市北區開元路144號1樓,場場過商行,地圖
台南市,安平區,台南市安平區育平路226號1樓,金禧運動彩券行,地圖
台南市,東區,台南市東區崇善路580號1樓,亞運國手運動彩券行,地圖
台南市,安南區,台南市安南區海佃路三段129號1樓,勝利運動彩券,地圖
台南市,東區,台南市東區大同路二段207號1樓,金福欣運動彩券行,地圖
台南市,北區,台南市北區北安路一段172號1樓,金包贏運動彩券,地圖
台南市,東區,台南市東區大同路二段95-1號1樓,運大桶彩券行,地圖
台南市,中西區,台南市中西區成功路401號1樓,焦點運動彩券,地圖
台南市,中西區,台南市中西區民權路三段36號1樓,心想事成運動彩券,地圖
台南市,東區,台南市東區崇德路381號1樓,瑞取運動彩券,地圖
台南市,中西區,台南市中西區民族路三段49號1樓,五月雨運動彩券,地圖
台南市,東區,台南市東區林森路二段50號1樓,冠畇運動彩券行,地圖
台南市,安南區,台南市安南區怡安路二段196號1樓,決勝運動彩券,地圖
台南市,安平區,台南市安平區文平路367號1樓,欣欣運動彩券行,地圖
台南市,北區,台南市北區公園路894號1樓,達陣運動彩券,地圖
台南市,北區,台南市北區開元路168號1樓,決勝點運動彩券,地圖
台南市,中西區,台南市中西區文賢路239號1樓,勁賀贏運動彩券行,地圖
台南市,東區,台南市東區中華東路二段133巷55號1樓,騰元運動彩券行,地圖
台南市,東區,台南市東區崇善路843號1樓,宥盈運動彩券行,地圖
台南市,安南區,台南市安南區安和路一段64號1樓,來就贏運動彩券行,地圖
台南市,東區,台南市東區東安路70號1樓,新星炸裂運動彩券,地圖
台南市,南區,台南市南區灣裡路329號1樓,名人運動彩券行,地圖
台南市,安南區,台南市安南區海佃路三段127號1樓,加倍旺運動彩券,地圖
台南市,中西區,台南市中西區永華路一段38號1樓,金賀椏運動彩券行,地圖
台南市,安南區,台南市安南區郡安路四段281號1樓,三冠王運動彩券行,地圖
台南市,南區,台南市南區金華路一段258號1樓,富裕運動彩券行,地圖
台南市,中西區,台南市中西區康樂街187號1樓,金發樂商行,地圖
台南市,安南區,台南市安南區安富街241號1樓,金穩營運動彩券行,地圖
台南市,南區,台南市南區國民路169號1樓,國民運動彩券行,地圖
台南市,安南區,台南市安南區海佃路三段125號1樓,乘勝進擊運動彩券,地圖
台南市,東區,台南市東區林森路二段210號1樓,森益豪運動彩券,地圖
台南市,北區,台南市北區成功路618號1樓,逆轉勝運動彩券,地圖
台南市,中西區,台南市中西區大同路一段150號1樓,皆大歡喜運動彩券,地圖
台南市,安南區,台南市安南區安和路四段490號1樓,正裕運動彩券行,地圖
台南市,中西區,台南市中西區青年路139號1樓,金好過運動彩券行,地圖
台南市,北區,台南市北區公園路126號1樓,金會營彩券行,地圖
台南市,南區,台南市南區夏林路7號1樓,祥爃運彩彩券行,地圖
台南市,佳里區,台南市佳里區文化路578號1樓,過關運動彩券,地圖
台南市,佳里區,台南市佳里區延平路348號1樓,朝揚運動彩券,地圖
台南市,仁德區,台南市仁德區中山路460號1樓,億興旺運動彩券,地圖
台南市,永康區,台南市永康區自強路772號1樓,世界盃運動彩券行,地圖
台南市,永康區,台南市永康區中華西街232號1樓,世界盃商行,地圖
台南市,永康區,台南市永康區中華路365號1樓,一級棒彩券行,地圖
台南市,麻豆區,台南市麻豆區興中路55巷17-3號1樓,得勝運動彩券,地圖
台南市,永康區,台南市永康區自強路380號1樓,福有運動彩券行,地圖
台南市,仁德區,台南市仁德區中正路二段399號1樓,金旺門運動彩券行,地圖
台南市,善化區,台南市善化區中山路43之1號1樓,通關勝運動彩券,地圖
台南市,新市區,台南市新市區中正路285號1樓,金城運動彩券行,地圖
台南市,永康區,台南市永康區中正北路90號1樓,富勝運動彩券行,地圖
台南市,善化區,台南市善化區中山路398號1樓,福立發運動彩券,地圖
台南市,新市區,台南市新市區民生路3號1樓,新活力旺運彩行,地圖
台南市,永康區,台南市永康區永大路二段901號1樓,冠軍商行,地圖
台南市,永康區,台南市永康區東橋一路111號1樓,國士無雙運動彩券,地圖
台南市,永康區,台南市永康區大灣路877號1樓,連連勝運動彩券行,地圖
台南市,柳營區,台南市柳營區中山西路二段198號1樓,尚顏運動彩券,地圖
台南市,新營區,台南市新營區延平路67號1樓,誌勝運動彩券,地圖
台南市,永康區,台南市永康區中山南路533號1樓,泰山運動彩券,地圖
台南市,永康區,台南市永康區大橋二街116號1樓,壹祈發運動彩券行,地圖
台南市,佳里區,台南市佳里區延平路300號1樓,至尊運動彩券,地圖
台南市,安定區,台南市安定區港尾里港子尾35-1號1樓,續航利運動彩券,地圖
台南市,永康區,台南市永康區大灣路231號1樓,金淼發運動彩券行,地圖
台南市,永康區,台南市永康區大灣路263號1樓,全壘打商行,地圖
台南市,新營區,台南市新營區民治路48號1樓,鑫滿億運彩行,地圖
台南市,歸仁區,台南市歸仁區民權北路30號1樓,晶來發運彩行,地圖
台南市,麻豆區,台南市麻豆區忠孝路25-21號1樓,穩仲運動彩券行,地圖
台南市,關廟區,台南市關廟區南雄路二段222號1樓,穩贏運動彩券行,地圖
台南市,學甲區,台南市學甲區濟生路205之1號1樓,旺旺萊運動彩券行,地圖
台南市,新化區,台南市新化區中山路524號1樓,晉億運動彩券,地圖
台南市,永康區,台南市永康區自強路333巷7號1樓,冠天下運動彩券行,地圖
台南市,新市區,台南市新市區仁愛街191號1樓,首席運動彩券,地圖
台南市,歸仁區,台南市歸仁區大通路76-1號1樓,金伍錢運動彩券行,地圖
台南市,新市區,台南市新市區民生路47號1樓,皇家運動彩券行,地圖
台南市,歸仁區,台南市歸仁區大廟一街133號1樓,大員彩券行,地圖
台南市,官田區,台南市官田區隆田里中山路一段94號1樓,日日進運動彩券,地圖
台南市,仁德區,台南市仁德區中清路59號1樓,愛買運動彩券,地圖
台南市,永康區,台南市永康區永大路二段820號1樓,天好運運動彩券行,地圖
台南市,永康區,台南市永康區中山東路101號1樓,金好中運動彩券行,地圖
台南市,六甲區,台南市六甲區中山路25號1樓,全勝運動彩券行,地圖
台南市,新市區,台南市新市區銘傳街122號1樓,強打者商行,地圖
台南市,歸仁區,台南市歸仁區中山路一段484號1樓,一六六運動彩券行,地圖
台南市,善化區,台南市善化區大成路344號1樓,上好運企業社,地圖
台南市,新化區,台南市新化區中山路305號1樓,益統運動彩券行,地圖
台南市,麻豆區,台南市麻豆區中正路59號1樓,踴躍運動彩券,地圖
台南市,關廟區,台南市關廟區南雄路二段85號1樓,聯贏彩券行,地圖
台南市,西港區,台南市西港區中山路255號1樓,好市多多運動彩券,地圖
台南市,永康區,台南市永康區復華七街75號1樓,英雄運動彩券行,地圖
台南市,鹽水區,台南市鹽水區中正路94號1樓,芝麻開門運動彩券,地圖
台南市,仁德區,台南市仁德區中正路二段433號1樓,幸運星運動彩券,地圖
台南市,下營區,台南市下營區中山路一段216號1樓,金好營彩券行,地圖
台南市,歸仁區,台南市歸仁區民權南路30號1樓,氣真旺運彩行,地圖
台南市,新營區,台南市新營區民治路6-1號1樓,大金庫商行,地圖
台南市,學甲區,台南市學甲區成功路1-2號1樓,金旺運動彩券行,地圖
台南市,麻豆區,台南市麻豆區興國路5號1樓,豪中運動彩券,地圖
台南市,永康區,台南市永康區正強街141號1樓,好運運動彩券,地圖
台南市,永康區,台南市永康區復國一路337號1樓,天下運動彩券行,地圖
台南市,歸仁區,台南市歸仁區中山路三段47號1樓,跑馬地運動彩券,地圖
台南市,麻豆區,台南市麻豆區民權路49-7號1樓,賴福運動彩券行,地圖
台南市,善化區,台南市善化區中正路503號1樓,金采鴻運動彩券行,地圖
台南市,學甲區,台南市學甲區中正路242號1樓,佰戰佰勝運動彩券,地圖
台南市,歸仁區,台南市歸仁區中正南路一段80號1樓,精準運動彩券,地圖
台南市,永康區,台南市永康區正新街36號1樓,正新旺運動彩券行,地圖
台南市,新營區,台南市新營區中興路36之6號1樓,大大春彩券行,地圖
台南市,仁德區,台南市仁德區德南路192號1樓,掘金運動彩券,地圖
台南市,永康區,台南市永康區中山路156號1樓,金得勝運動彩券行,地圖
台南市,新化區,台南市新化區信義路442之1號1樓,新化運彩投注站,地圖
台南市,白河區,台南市白河區中正路73號1樓,盈佳運動彩券行,地圖
台南市,學甲區,台南市學甲區華宗路413號1樓,福樂運動彩券行,地圖
台南市,新市區,台南市新市區中正路303號1樓,發發發運動彩券,地圖
台南市,新市區,台南市新市區仁愛街268號1樓,超前運動彩券,地圖
台南市,永康區,台南市永康區中山南路37號1樓,出奇制勝運動彩券,地圖
台南市,安定區,台南市安定區港口里港口212號1樓,穩勝運動彩券行,地圖
台南市,永康區,台南市永康區大灣路584號1樓,橫掃千金運動彩券,地圖
台南市,善化區,台南市善化區中山路283-1號1樓,大內高手運動彩券,地圖
台南市,六甲區,台南市六甲區民生街32號1樓,神采飛揚運動彩券,地圖
台南市,佳里區,台南市佳里區中山路370號1樓,鑽發運動彩券,地圖
台南市,新化區,台南市新化區忠孝路128號1樓,虎贏運動彩券行,地圖
台南市,永康區,台南市永康區中華一路150號1樓,制勝點運動彩券,地圖
台南市,佳里區,台南市佳里區中山路154號1樓,捷報運動彩券,地圖
台南市,佳里區,台南市佳里區中山路182號1樓,繽紛運動彩券,地圖
台南市,永康區,台南市永康區中山南路213號1樓,大滿貫運動彩券行,地圖
台南市,永康區,台南市永康區中華二路292號1樓,壬寶運動彩券行,地圖
台南市,永康區,台南市永康區永明街67之2號1樓,冠天下商行,地圖
台南市,永康區,台南市永康區中正路175號1樓,高勝率運動彩券行,地圖
台南市,永康區,台南市永康區復國一路323號1樓,文化運動彩券行,地圖
台南市,善化區,台南市善化區中山路443號1樓,炭飽飽運動彩券行,地圖
台南市,新營區,台南市新營區復興路157-11號1樓,活躍運動彩券,地圖
台南市,仁德區,台南市仁德區仁義路27號1樓,双贏運動彩券行,地圖
台南市,西港區,台南市西港區慶安里中山路313號1樓,鯉龍贏運動彩券行,地圖
台南市,永康區,台南市永康區中華西街84號1樓,超勝運動彩券行,地圖
台南市,永康區,台南市永康區中正路706號1樓,瘋運彩運動彩券行,地圖
台南市,下營區,台南市下營區中山路二段58號1樓,奪冠運動彩券,地圖
桃園市,中壢區,桃園市中壢區新明路55號1樓,金寶王運動彩券,地圖
桃園市,大溪區,桃園市大溪區慈湖路111號1樓,活力運動彩券行,地圖
桃園市,楊梅區,桃園市楊梅區文化街295巷2號1樓,旺旺鑫運動彩券,地圖
桃園市,中壢區,桃園市中壢區民族路42號1樓,鑫銘彩券行,地圖
桃園市,觀音區,桃園市觀音區成功路一段571號1樓,翻喜運動彩券行,地圖
桃園市,大溪區,桃園市大溪區介壽路1117號1樓,大筆發財運動商行,地圖
桃園市,新屋區,桃園市新屋區中華路232號1樓,大滿貫運動彩券,地圖
桃園市,觀音區,桃園市觀音區成功路一段633號1樓,鑫成功運動彩券行,地圖
桃園市,楊梅區,桃園市楊梅區新農街6之3號1樓,聯發運動彩券行,地圖
桃園市,中壢區,桃園市中壢區龍東路321號1樓,天王星運彩行,地圖
桃園市,楊梅區,桃園市楊梅區環東路486號1樓,天佑運動彩券行,地圖
桃園市,大園區,桃園市大園區中山北路187號1樓,中量級運動彩券行,地圖
桃園市,楊梅區,桃園市楊梅區文化街268號1樓,哈登二世彩券行,地圖
桃園市,大溪區,桃園市大溪區員林路一段303號1樓,名人運動彩券行,地圖
桃園市,平鎮區,桃園市平鎮區廣德街236號1樓,一支獨秀運動彩券行,地圖
桃園市,平鎮區,桃園市平鎮區中豐路南勢二段145號1樓,鈞禾登運動彩券行,地圖
桃園市,大溪區,桃園市大溪區介壽路1163號1樓,璽錸運動彩券行,地圖
桃園市,中壢區,桃園市中壢區中園路二段152號1樓,大贏家運動彩券行,地圖
桃園市,大溪區,桃園市大溪區員林路二段390之3號1樓,富婆運動彩券行,地圖
桃園市,中壢區,桃園市中壢區大同路104號1樓,星野運動投注站,地圖
桃園市,大園區,桃園市大園區中正東路三段598號1樓,圓夢運動彩券行,地圖
桃園市,平鎮區,桃園市平鎮區振興路30號1樓,世界準運動彩券行,地圖
桃園市,中壢區,桃園市中壢區永福路736號1樓,非中不可彩券行,地圖
桃園市,楊梅區,桃園市楊梅區新農街140號1樓,威雄豪運動彩券行,地圖
桃園市,平鎮區,桃園市平鎮區振興路116號1樓,喜財發投注站,地圖
桃園市,楊梅區,桃園市楊梅區大成路140號1樓,欣聖企業社,地圖
桃園市,平鎮區,桃園市平鎮區南豐路81號1樓,運通運動彩券行,地圖
桃園市,楊梅區,桃園市楊梅區成功路22號1樓,富岡成功運動彩券,地圖
桃園市,中壢區,桃園市中壢區中豐路192號1樓,鼎盛發運彩投注站,地圖
桃園市,觀音區,桃園市觀音區中山路二段640號1樓,美大運動彩券行,地圖
桃園市,中壢區,桃園市中壢區龍東路512號1樓,仟佰億運動彩券行,地圖
桃園市,中壢區,桃園市中壢區福德路91號1樓,三冠王彩券行,地圖
桃園市,中壢區,桃園市中壢區龍東路232號1樓,領航運動彩券行,地圖
桃園市,中壢區,桃園市中壢區中山東路三段239號1樓,旺神運動彩券行,地圖
桃園市,中壢區,桃園市中壢區忠孝路339號1樓,添好運企業社,地圖
桃園市,中壢區,桃園市中壢區中北路二段408號1樓,鈞立澄運動彩券行,地圖
桃園市,中壢區,桃園市中壢區延平路555號1樓,千意運動彩券行,地圖
桃園市,平鎮區,桃園市平鎮區中豐路山頂段284號1樓,英超曼聯運動彩券行,地圖
桃園市,新屋區,桃園市新屋區中山東路2段857號1樓,滿點運動彩券行,地圖
桃園市,中壢區,桃園市中壢區永福路698號1樓,連勝發企業社,地圖
桃園市,平鎮區,桃園市平鎮區民族路雙連二段227號1樓,田彩運動彩券行,地圖
桃園市,觀音區,桃園市觀音區中正路266號1樓,有錢運動彩券行,地圖
桃園市,觀音區,桃園市觀音區四維路53號1樓,玩家運動彩券行,地圖
桃園市,中壢區,桃園市中壢區龍東路435號1樓,佳品運動彩券行,地圖
桃園市,楊梅區,桃園市楊梅區文化街226號1樓,耀貴運動彩券行,地圖
桃園市,龍潭區,桃園市龍潭區中興路298號1樓,一級棒運動彩券行,地圖
桃園市,龍潭區,桃園市龍潭區中豐路325號1樓,鏵澄運動彩券行,地圖
桃園市,楊梅區,桃園市楊梅區大成路119號1樓,發發財運動彩券行,地圖
桃園市,大園區,桃園市大園區華興路200號1樓,金福氣運動彩券行,地圖
桃園市,龍潭區,桃園市龍潭區中興路242號1樓,運彩樂運動彩券行,地圖
桃園市,中壢區,桃園市中壢區健行路172號1樓,順風旺運動彩券,地圖
桃園市,楊梅區,桃園市楊梅區環南路6號1樓,六角鑫鑫運動彩券,地圖
桃園市,中壢區,桃園市中壢區新中北路二段477號1樓,新富發運動彩券,地圖
桃園市,中壢區,桃園市中壢區元化路1之4號1樓,順風來彩券行,地圖
桃園市,平鎮區,桃園市平鎮區和平路154號1樓,球王運動彩券行,地圖
桃園市,中壢區,桃園市中壢區成章二街487號1樓,鴻運運動投注站,地圖
桃園市,大園區,桃園市大園區埔心街52-27號1樓,順風水運動彩券行,地圖
桃園市,中壢區,桃園市中壢區九和三街40號1樓,百發必中運動彩券行,地圖
桃園市,中壢區,桃園市中壢區中正路368號1樓,冥王星運彩行,地圖
桃園市,平鎮區,桃園市平鎮區文化街33號1樓,火箭人運動彩券行,地圖
桃園市,平鎮區,桃園市平鎮區延平路三段46號1樓,英超曼城運動彩券行,地圖
桃園市,中壢區,桃園市中壢區新中北路204號1樓,滿旺彩券行,地圖
桃園市,中壢區,桃園市中壢區龍川街6號1樓,六顆星彩券行,地圖
桃園市,楊梅區,桃園市楊梅區楊新路75號1樓,嘉銘運動彩券行,地圖
桃園市,楊梅區,桃園市楊梅區中興路24號1樓,非中不可運動彩券行,地圖
桃園市,中壢區,桃園市中壢區新生路191號1樓,福得運動彩券,地圖
桃園市,大溪區,桃園市大溪區民權東路166號1樓,精英運動彩券行,地圖
桃園市,中壢區,桃園市中壢區中美路二段64號1樓,盈吉多投注站,地圖
桃園市,中壢區,桃園市中壢區成章一街39號1樓,獎金大本營運動彩券,地圖
桃園市,龍潭區,桃園市龍潭區中正路124號1樓,滿貫炮彩券行,地圖
桃園市,平鎮區,桃園市平鎮區育達路227號1樓,金寶通運動彩券行,地圖
桃園市,觀音區,桃園市觀音區成功路一段549號1樓,贏冠軍運動彩券行,地圖
桃園市,中壢區,桃園市中壢區中北路二段424號1樓,金大福運動彩券行,地圖
桃園市,大園區,桃園市大園區和平東路19號1樓,運神運動彩券行,地圖
桃園市,中壢區,桃園市中壢區興農路86號1樓,永慶運動彩券行,地圖
桃園市,龍潭區,桃園市龍潭區龍元路3號1樓,得金牌運動彩券,地圖
桃園市,中壢區,桃園市中壢區龍東路22號1樓,金賺彩券行,地圖
桃園市,大園區,桃園市大園區中山北路71號1樓,運速運動彩券行,地圖
桃園市,中壢區,桃園市中壢區吉林二路87號1樓,金宇運動彩券行,地圖
桃園市,大園區,桃園市大園區菓林路110號1樓,太空人運動投注站,地圖
桃園市,平鎮區,桃園市平鎮區廣德街189號1樓,勝投王運動彩券,地圖
桃園市,楊梅區,桃園市楊梅區梅獅路二段67號1樓,馬上有錢運動彩券行,地圖
桃園市,大溪區,桃園市大溪區員林路一段238號1樓,大滿貫商行,地圖
桃園市,楊梅區,桃園市楊梅區民族路五段153號1樓,順盈投注站,地圖
桃園市,中壢區,桃園市中壢區中央西路二段157號1樓,活力發運動彩券行,地圖
桃園市,楊梅區,桃園市楊梅區青山五街18號1樓,超人運動彩券行,地圖
桃園市,中壢區,桃園市中壢區龍東路371號1樓,金滿財運動彩券行,地圖
桃園市,新屋區,桃園市新屋區中華路243之5號1樓,飛皇騰達運動彩券行,地圖
桃園市,大園區,桃園市大園區大工路70號1樓,頭榜運動彩券行,地圖
桃園市,中壢區,桃園市中壢區福州二街388號1樓,錸下注運動彩券行,地圖
桃園市,中壢區,桃園市中壢區長春路76號1樓,兆豐運彩商行,地圖
桃園市,中壢區,桃園市中壢區中央西路二段229號1樓,赤兔馬運動彩券行,地圖
桃園市,觀音區,桃園市觀音區大觀路二段165號1樓,大秘寶運動彩券行,地圖
桃園市,楊梅區,桃園市楊梅區中山北路二段119號1樓,英超運動彩券行,地圖
桃園市,大園區,桃園市大園區大觀路20之1號1樓,大吉大利運動彩券行,地圖
桃園市,中壢區,桃園市中壢區新中北路二段463號1樓,欣儒商行,地圖
桃園市,平鎮區,桃園市平鎮區中豐路南勢二段114號1樓,連霸運彩行,地圖
桃園市,龍潭區,桃園市龍潭區大同路2之2號1樓,金牌王運動彩券行,地圖
桃園市,中壢區,桃園市中壢區日新路2號1樓,金兆豐運動彩券行,地圖
桃園市,中壢區,桃園市中壢區榮安一街151號1樓,洋金企業社,地圖
桃園市,中壢區,桃園市中壢區興農路97號1樓,佰吉商行,地圖
桃園市,龍潭區,桃園市龍潭區新龍路160號1樓,籃球王運動彩券行,地圖
桃園市,觀音區,桃園市觀音區大觀路二段117號1樓,鴻觀運動彩券行,地圖
桃園市,中壢區,桃園市中壢區領航南路一段5號1樓,樂運運動彩券行,地圖
桃園市,新屋區,桃園市新屋區中山路388號1樓,幸運球運動彩券行,地圖
桃園市,楊梅區,桃園市楊梅區民族路五段251號1樓,鈞禾運動彩券行,地圖
桃園市,平鎮區,桃園市平鎮區延平路二段172號1樓,鑫旺福運動彩券行,地圖
桃園市,楊梅區,桃園市楊梅區中山路31號1樓,人流運動投注站,地圖
桃園市,中壢區,桃園市中壢區莊敬路867號1樓,錢來發運動彩券行,地圖
